id,title,author,subreddit,score,num_comments,created_utc,url
1fl7jqv,Have Hezbollah's secret communications been compromised?,JeffCook78,technology,100,137,1726822755.0,https://www.newsweek.com/hezbollah-communications-compromised-pager-attacks-1956406
1fkzw9b,The United Nations Wants to Treat AI With the Same Urgency as Climate Change,MetaKnowing,technology,426,99,1726793496.0,https://www.wired.com/story/united-nations-artificial-intelligence-report/
1fm96l5,Apple’s Update Decision—Google Ridicules iPhone As Bad News Confirmed,Fit-Requirement6701,technology,0,1,1726942359.0,https://www.forbes.com/sites/zakdoffman/2024/09/21/apples-ios-18-update-googles-new-warning-for-millions-of-phone-15-iphone-16-users/
1fll1xy,Qualcomm Approached Intel About a Takeover in Recent Days,notyour_motherscamry,technology,11,5,1726862317.0,https://www.wsj.com/business/deals/qualcomm-approached-intel-about-a-takeover-in-recent-days-fa114f9d?mod=hp_lead_pos1
1fkpot0,Low cognitive ability intensifies the link between social media use and anti-immigrant attitudes,a_Ninja_b0y,technology,1513,146,1726764894.0,https://www.psypost.org/low-cognitive-ability-intensifies-the-link-between-social-media-use-and-anti-immigrant-attitudes/
1fkjulu,Microsoft Executive Warns of Election Meddling in Final 48 Hours,Fit-Requirement6701,technology,3234,173,1726749645.0,https://www.bloomberg.com/news/articles/2024-09-18/microsoft-executive-warns-of-election-meddling-in-final-48-hours
1fksp6m,Apple introduces California driver’s licenses and state IDs in Apple Wallet as part of California DMV’s mDL pilot program,Puginator,technology,996,109,1726772412.0,https://www.apple.com/newsroom/2024/09/apple-brings-california-drivers-licenses-and-state-ids-to-apple-wallet/
1fkp5wm,Tor anonymity infiltrated: Law enforcement monitors servers successfully ,a_Ninja_b0y,technology,1502,74,1726763574.0,https://www.ghacks.net/2024/09/19/tor-anonymity-infiltrated-law-enforcement-monitors-servers-successfully/
1fkn1wy,"Palworld developer has no idea why Nintendo’s suing over its Pokémon-like game | In a statement released earlier today, Pocketpair said it isnt aware of any patents it infringed in developing Palworld.",chrisdh79,technology,1829,256,1726758251.0,https://www.theverge.com/2024/9/19/24248957/pocketpair-pokemon-patent-infrigement-lawsuit
1fl6yma,"Canada’s Leaders Must Reject Overbroad Age Verification Bill | Canadian lawmakers are considering a bill, S-210, that’s meant to benefit children, but would sacrifice the security, privacy, and free speech of all internet users",a_Ninja_b0y,technology,71,8,1726819972.0,https://www.eff.org/deeplinks/2024/09/canadas-leaders-must-reject-overbroad-age-verification-bill
1fl32t3,"Social media and online video firms are conducting ‘vast surveillance’ on users, FTC finds ",caveatlector73,technology,162,12,1726803781.0,https://www.theguardian.com/technology/2024/sep/19/social-media-companies-surveillance-ftc
1fl80rp,Huawei's trifold smartphone is launching the same day as the iPhone 16 — and it's already creating a frenzy on resale sites,ControlCAD,technology,42,135,1726824923.0,https://www.businessinsider.com/huawei-mate-xt-resale-prices-skyrocket-apple-2024-9
1fl8mvp,"Seeking to counter China, US awards $3 billion for EV battery production in 14 states",spherocytes,technology,41,3,1726827601.0,https://apnews.com/article/ev-batteries-lithium-biden-harris-china-3eaa57b34878a23dd55fe167eb8095f2
1fll776,"Tech giants push to dilute Europe's AI Act
",CatUsaUk,technology,6,3,1726862685.0,https://www.reuters.com/technology/artificial-intelligence/tech-giants-push-dilute-europes-ai-act-2024-09-20/
1fkbjtk,YouTube confirms your pause screen is now fair game for ads,ardi62,technology,15726,2280,1726716477.0,https://www.theverge.com/2024/9/18/24248391/youtube-pause-ads-widely-rolling-out
1flbzwu,"S. Korea, Czech Republic agree to team up for full cycle of nuclear energy industry",Saltedline,technology,19,0,1726838829.0,https://m-en.yna.co.kr/view/AEN20240920009051315?section=national/politics
1fm7cq1,Can AI Companions Help Cure the Loneliness Epidemic?,newzee1,technology,0,15,1726937411.0,https://www.wsj.com/health/wellness/ai-companions-loneliness-f6b16e98?st=mv1x9R
1fks4ck,Disney to Stop Using Slack Following Hack That Exposed Company Data,habichuelacondulce,technology,483,22,1726770920.0,https://www.wsj.com/business/disney-to-stop-using-slack-following-hack-that-exposed-company-data-c5311caf
1fm3w7h,"How Apple, Google, and Microsoft can save us from AI deepfakes",Franco1875,technology,0,2,1726927798.0,https://www.zdnet.com/article/how-apple-google-and-microsoft-can-save-us-from-ai-deepfakes/
1fkhz5b,Justice Department disrupts vast Chinese hacking operation that infected consumer devices,zsreport,technology,1730,32,1726743424.0,https://apnews.com/article/fbi-justice-department-chinese-hacking-84e16185ae16367443a5e083adb74c8c
1flakwn,Microsoft’s AI Power Needs Prompt Revival of Three Mile Island Nuclear Plant,ead09,technology,15,5,1726834649.0,https://www.bnnbloomberg.ca/business/technology/2024/09/20/microsofts-ai-power-needs-prompt-revival-of-three-mile-island-nuclear-plant/
1fknea1,F.T.C. Study Finds ‘Vast Surveillance’ of Social Media Users,whosthesixth,technology,739,60,1726759117.0,https://www.nytimes.com/2024/09/19/technology/ftc-meta-tiktok-privacy-surveillance.html
1flydff,Qualcomm Approached Intel About a Takeover in Recent Days,n1ght_w1ng08,technology,0,0,1726907289.0,https://www.wsj.com/business/deals/qualcomm-approached-intel-about-a-takeover-in-recent-days-fa114f9d
1fkkmcp,Billionaire tech CEO says bosses shouldn't 'BS' employees about the impact AI will have on jobs,MetaKnowing,technology,904,178,1726751860.0,https://www.cnbc.com/2024/09/19/billionaire-tech-ceo-bosses-shouldnt-bs-employees-about-ai-impact.html
1flz0c8,Bank of Canada: AI could boost inflationary pressures in short-term,Advanced_Drink_8536,technology,0,1,1726910166.0,https://www.reuters.com/markets/bank-canada-ai-could-boost-inflationary-pressures-short-term-2024-09-20/
1fkjwd6,Massive China-state IoT botnet went undetected for four years—until now,AdSpecialist6598,technology,863,79,1726749793.0,https://arstechnica.com/security/2024/09/massive-china-state-iot-botnet-went-undetected-for-four-years-until-now/
1fkhqgo,Lebanon bans pagers and walkie-talkies on flights,marketrent,technology,1084,347,1726742465.0,https://www.ynetnews.com/article/h1qaq00kp0
1fld9mo,Chechnya’s Kadyrov sends two Tesla Cybertrucks to Russian troops Ukraine as his own is disabled,duckanroll,technology,6,8,1726842248.0,https://novayagazeta.eu/articles/2024/09/20/chechnyas-kadyrov-sends-two-tesla-cybertrucks-to-ukraine-as-his-own-is-disabled-en-news
1fl390z,Microsoft releases a new Windows app called Windows App for running Windows apps,ardi62,technology,41,64,1726804400.0,https://arstechnica.com/gadgets/2024/09/microsoft-releases-a-new-windows-app-called-windows-app-for-running-windows-apps/?comments=1
1fkebs0,"Forget tedious paper applications, Americans can now renew passports online",a_Ninja_b0y,technology,1938,100,1726726891.0,https://www.npr.org/2024/09/18/g-s1-23620/americans-passport-renew-online
1fk2fbz,Apple iPhone 16 demand is so weak that employees can already buy it on discount,lurker_bee,technology,21538,2957,1726690437.0,https://qz.com/apple-iphone-16-pre-orders-sales-intelligence-ai-1851651638
1flom32,AI has returned chipmaking to the heart of computer technology,MarshallGrover,technology,0,2,1726871962.0,https://www.economist.com/technology-quarterly/2024/09/16/ai-has-returned-chipmaking-to-the-heart-of-computer-technology
1fkg9y6,Google is going to show you even more ads on YouTube soon,thegravity98ms2,technology,910,353,1726736021.0,https://www.xda-developers.com/youtube-ads-pause-video/
1flynd9,Tips to prevent oversharing information about your kids online,KalkiKalpa,technology,0,16,1726908526.0,https://www.usatoday.com/story/tech/problemsolved/2024/09/20/how-to-protect-child-info-online/75208085007/
1fkwi1j,How Lebanon's wireless paging system was weaponized to make Hezbollah devices explode,Zealousideal-Ask4232,technology,67,47,1726783516.0,https://www.voanews.com/a/how-lebanon-s-wireless-paging-system-was-weaponized-to-make-hezbollah-devices-explode/7791044.html
1fkslw0,FTC Staff Report Finds Large Social Media and Video Streaming Companies Have Engaged in Vast Surveillance of Users with Lax Privacy Controls and Inadequate Safeguards for Kids and Teens,net_dev_ops,technology,112,7,1726772152.0,https://www.ftc.gov/news-events/news/press-releases/2024/09/ftc-staff-report-finds-large-social-media-video-streaming-companies-have-engaged-vast-surveillance
1fllgbw,AI tools help uncover enzyme mechanisms for lasso peptides,FollowTheLeads,technology,1,0,1726863365.0,https://phys.org/news/2024-09-ai-tools-uncover-enzyme-mechanisms.html
1fkjfe5,“Dead Internet theory” comes to life with new AI-powered social media app,polimeema,technology,339,52,1726748376.0,https://arstechnica.com/information-technology/2024/09/dead-internet-theory-comes-to-life-with-new-ai-powered-social-media-app/
1fl8ybe,Taiwan questions two in probe into Hezbollah pagers,MyNameCannotBeSpoken,technology,4,7,1726828940.0,https://www.timesofisrael.com/liveblog_entry/taiwan-questions-two-in-probe-into-hezbollah-pagers/
1fk7v14,Nintendo and Pokémon are suing Palworld maker Pocketpair,esporx,technology,2511,496,1726705196.0,https://www.theverge.com/2024/9/18/24248602/nintendo-pokemon-palworld-pocketpair-patent-infringement-lawsuit
1fkkupa,"Is That AI? Or Does It Just Suck? AI is becoming synonymous with things that are unbelievable, generic, or just a little bit off",StrngBrew,technology,220,16,1726752510.0,https://nymag.com/intelligencer/article/is-that-ai-or-does-it-just-suck.html
1fjz1fh,"Amazon CEO Andy Jassy ordered a five-day return to office policy, but research suggests he’ll backtrack next year",marketrent,technology,6143,282,1726681863.0,https://fortune.com/2024/09/18/amazon-andy-jassy-ordering-full-time-return-to-office-rto-research-backtrack/
1fk9w2s,U.S. and allies seize control of massive Chinese tech spying network,taike0886,technology,1165,27,1726711259.0,https://www.msn.com/en-us/news/world/u-s-and-allies-seize-control-of-massive-chinese-tech-spying-network/ar-AA1qNHb6
1fjvr5y, Walkie talkies explode in Lebanon at funeral for those killed in pager attack,geoxol,technology,8004,1736,1726673644.0,https://abc7.com/post/explosions-witnessed-beirut-funeral-hezbollah-members-child-killed-pager-attack/15320074/
1fl2zje,Palantir Wins $100 Million US Contract for AI Targeting Tech,caveatlector73,technology,10,4,1726803469.0,https://www.bloomberg.com/news/articles/2024-09-19/palantir-wins-100-million-us-contract-for-ai-targeting-tech?srnd=phx-technology
1fkesq3,Forced and Child Labor Abuses Found in 75% of Lithium Battery Supply Chains,Stock-Traffic-9468,technology,359,43,1726729051.0,https://www.wardsauto.com/suppliers/forced-and-child-labor-abuses-found-in-75-of-lithium-battery-supply-chains
1fkp5jq,28 Years Later: Danny Boyle’s New Zombie Flick Was Shot on an iPhone 15,Fit-Requirement6701,technology,59,7,1726763548.0,https://www.wired.com/story/28-years-later-danny-boyles-new-zombie-flick-was-shot-on-an-iphone-15/
