id,title,author,subreddit,score,num_comments,created_utc,url
1flvcbv,Final Fantasy 16 producer Naoki Yoshida asks that modders please don't run amok with 'offensive or inappropriate' shenanigans now the game's on PC,LollipopChainsawZz,technology,119,52,1726894303.0,https://www.pcgamer.com/games/rpg/final-fantasy-16-director-naoki-yoshida-asks-that-modders-please-dont-run-amok-with-offensive-or-inappropriate-shenanigans-now-the-games-on-pc/
1fm8n0a,Harris accepts CNN offer for 2nd presidential debate on Oct. 23,Ace-Cuddler,politics,56,12,1726940874.0,https://abcnews.go.com/Politics/harris-accepts-cnn-offer-2nd-presidential-debate-oct/story?id=113899130
1fm6xi7,"Harris accepts CNN invitation to second debate, urges Trump to join",No-Attitude-6049,politics,67,10,1726936259.0,https://www.reuters.com/world/us/harris-accepts-cnn-invitation-second-debate-urges-trump-join-2024-09-21/
1fm663t,Harris campaign lays out its Mark Robinson strategy in North Carolina,Kiss_My_Wookiee,politics,76,13,1726934181.0,https://www.politico.com/news/2024/09/21/harris-memo-mark-robinson-nc-strategy-00180357
1fm88vq,OpenAI staffers reportedly 'taken aback' by 'ominous' logo rebranding | The company is reportedly switch its current logo for one that looks like a black 'O.',MetaKnowing,technology,11,6,1726939818.0,https://www.engadget.com/ai/openai-staffers-reportedly-taken-aback-by-ominous-logo-rebranding-160017936.html
1fm4npu,Republicans Boost Jill Stein as Potential Harris Spoiler,ishtar_the_move,politics,90,82,1726929976.0,https://www.wsj.com/politics/elections/jill-stein-republican-support-harris-voters-5a194ebf?mod=hp_lead_pos6
1fm4f5w,What Trump has promised to do on ‘day one’ as president ,washingtonpost,politics,87,38,1726929302.0,https://www.washingtonpost.com/politics/2024/09/21/trump-day-one-promises-president-election/?utm_campaign=wp_main&utm_medium=social&utm_source=reddit.com
1fm0m09,"Man, The Senate Judiciary Committee Is Broken",cram213,politics,161,10,1726917067.0,https://www.huffpost.com/entry/maya-berry-john-kennedy-senate-judiciary-committee_n_66eddfaae4b07dd371cccc9e
1fm6oqy,Harris triples Trump’s fundraising in August as campaigns approach final stretch,its_Ghanou,politics,67,9,1726935582.0,https://www.washingtonexaminer.com/news/campaigns/presidential/3162246/harris-triples-trump-fundraising-august-campaigns-approach-final-stretch/
1fl2j0y,23andMe faces Nasdaq delisting after its entire board resigns,ChocolateTsar,technology,18263,977,1726801886.0,https://www.cnbc.com/video/2024/09/19/23andme-facing-nasdaq-delisting-after-entire-board-resigns.html
1fl95ev,Ted Cruz Losing to Colin Allred for First Time: Texas Poll,Coffee_n_wifi,politics,38036,1398,1726829719.0,https://www.newsweek.com/ted-cruz-losing-colin-allred-first-time-texas-poll-us-senate-election-1956711
1flw0e9,"Trump’s threats to ‘go after’ opponents will subvert rule of law, experts warn ",caveatlector73,politics,436,48,1726896947.0,https://www.theguardian.com/us-news/2024/sep/20/trump-election-opponents-threats
1fm5g74,"Court rules nearly 98,000 Arizonans whose citizenship hadn’t been confirmed can vote the full ballot",bummed_athlete,politics,74,13,1726932188.0,https://www.politico.com/news/2024/09/20/court-rules-nearly-98-000-arizonans-whose-citizenship-hadnt-been-confirmed-can-vote-the-full-ballot-00180354
1fluq63,Thousands turn out in Fairfax Co. for first day of early voting in Va.,fornuis,politics,544,34,1726891934.0,https://wtop.com/virginia/2024/09/thousands-turn-out-in-fairfax-co-for-first-day-of-early-voting-in-va/
1flg7n0,Congress Poised To Bring Back Unfettered Patent Trolling,Fit-Requirement6701,technology,957,52,1726849775.0,https://abovethelaw.com/2024/09/congress-poised-to-bring-back-unfettered-patent-trolling/
1fm03zb,‘People need to see it’: How politics hung up a $42B Biden internet buildout,jecht8,politics,162,7,1726915015.0,https://www.politico.com/news/2024/09/04/biden-broadband-program-swing-state-frustrations-00175845
1fm9147,"Trump Makes Shocking Decision on Scandal-Ridden Mark Robinson | 
Turns out, Mark Robinson still hasn’t done enough to turn off Donald Trump.",Murky-Site7468,politics,42,18,1726941937.0,https://newrepublic.com/post/186223/donald-trump-mark-robinson-scandal-decision
1fm8fla,Arizona Supreme Court rules nearly 100K can receive full ballots without citizenship proof,MobileWisdom,politics,45,15,1726940322.0,https://thehill.com/regulation/court-battles/4892271-arizona-supreme-court-citizenship-ballot/
1flvcg0,Mark Robinson's mistake with MAGA: Not owning his pro-Hitler posts,elliottbaytrail,politics,422,44,1726894317.0,https://www.salon.com/2024/09/21/mark-robinsons-big-mistake-with-maga-being-afraid-to-own-his-pro-hitler-posts/
1fm0gr8,"Court rules nearly 98,000 Arizonans whose citizenship hadn't been confirmed can vote the full ballot",BobbyLucero,politics,139,14,1726916494.0,https://apnews.com/article/arizona-voter-citizenship-proof-elections-court-15703fd0ee76359af0eb1b7539df1cc7
1fm5sc2,Lies About Immigration Help No One,theatlantic,politics,57,11,1726933135.0,https://www.theatlantic.com/politics/archive/2024/09/springfield-trump-vance-lies-immigrants/679959/?utm_source=reddit&utm_medium=social&utm_campaign=the-atlantic&utm_content=edit-promo
1fm7c3t,Texas Attorney General’s office sues Harris County over revised basic income program. Paxton earlier this year struck down the county’s efforts to provide monthly stipends to lower-income families. He requested the state prohibit payments under the county’s pilot guaranteed income program.,southpawFA,politics,43,13,1726937364.0,https://www.houstonpublicmedia.org/articles/news/harris-county/2024/09/19/500409/texas-attorney-generals-office-again-sues-harris-county-over-proposed-basic-income-program/
1fm0jg7,"Harris’ cash edge funds advertising blitz as Elon Musk cuts big check to House Republicans, new filings show",trifecta,politics,124,13,1726916786.0,https://www.cnn.com/2024/09/21/politics/fundraising-harris-trump-elon-musk/index.html?utm_medium=social&utm_source=blueskyCNN&utm_content=2024-09-21T10%3A40%3A47
1flx2n9,Trump Still Silent on Mark Robinson as Republicans Speak Out,vsandrei,politics,272,36,1726901475.0,https://www.newsweek.com/trump-still-silent-mark-robinson-republicans-speak-out-1957266
1flej0j,Anker recalls three power banks due to fire risk - stop using them now,lurker_bee,technology,968,74,1726845500.0,https://www.zdnet.com/home-and-office/energy/anker-recalls-three-power-banks-due-to-fire-risk-stop-using-them-now/
1fm466r,Donald Trump Says Women Will Be ‘Happy and Great Again’ If He Wins,Quirkie,politics,73,34,1726928588.0,https://www.thedailybeast.com/donald-trump-says-women-will-be-happy-and-great-again-if-he-wins
1fld83s,'I haven't seen it': GOP lawmaker admits he had no evidence to back up voting fraud claims,tigermountains,politics,5823,143,1726842137.0,https://www.msnbc.com/morning-joe/watch/-i-haven-t-seen-it-gop-lawmaker-admits-he-had-no-evidence-to-back-up-voting-fraud-claims-219779141992
1flr080,Lewd posts by Trump-backed candidate for NC governor removed from porn forum,tuftedear,politics,813,72,1726879185.0,https://www.cnn.com/2024/09/20/politics/posts-removed-porn-forum-mark-robinson-north-carolina-kfile/index.html
1fm7b9w,Hillary Clinton says Vance’s child care comments are ‘not in touch’ with most Americans’ lives,aslan_is_on_the_move,politics,42,14,1726937300.0,https://www.cnn.com/2024/09/19/politics/hillary-clinton-jd-vance-child-care/
1fm8724,Harris accepts invitation for second potential debate in October,nbcnews,politics,35,3,1726939685.0,https://www.nbcnews.com/politics/2024-election/harris-accepts-invitation-second-debate-october-rcna172104
1floi98,Porn site user linked to Mark Robinson also praised Hitler’s Mein Kampf,mymomknowsyourmom,politics,1055,50,1726871654.0,https://www.washingtonpost.com/politics/2024/09/20/mark-robinson-mein-kampf-porn-posts/
1fm7vjg,How influencers flocked to Springfield chasing debunked rumors and attention,npr,politics,35,13,1726938802.0,https://www.npr.org/2024/09/20/nx-s1-5112682/springfield-influencers-haitian-immigrants-social-media-trump
1flakx9,"Trump says if he loses to Harris, ""Jewish people would have a lot to do"" with it",etfvfva,politics,7529,922,1726834651.0,https://www.axios.com/2024/09/20/trump-jewish-voters-antisemitism-election
1flggnc,Brazil Supreme Court fines X over noncompliance with suspension order,Wagamaga,technology,623,20,1726850419.0,https://www.jurist.org/news/2024/09/brazil-supreme-court-fines-x-over-noncompliance-with-suspension-order/
1fm7e1r,Georgia election board approves controversial rule change requiring ballots be hand-counted,Severe_County_5041,politics,40,19,1726937514.0,https://abcnews.go.com/Politics/georgia-election-board-approves-controversial-rule-change-requiring/story?id=113876120&cid=social_twitter_abcn
1flf06d,Robinson will not appear at Trump’s North Carolina rally after report on alleged online comments,theombudsmen,politics,3729,251,1726846707.0,https://apnews.com/article/north-carolina-governor-mark-robinson-trump-kamala-harris-cooper-cnn-stein-c7ee5c23f554f3708619d6b68e208b94
1fl8saj,The Deaths of Two Mothers in Georgia Show That Ending Roe Was Never About “Life”,Murky-Site7468,politics,11527,145,1726828240.0,https://slate.com/news-and-politics/2024/09/supreme-court-abortion-ban-roe-life-lie.html?pay=1726827826959&support_journalism=please
1flu6vx,Donald Trump biopic 'The Apprentice' sets pre-election release date,duedate2010,politics,387,23,1726890016.0,https://www.nbcnews.com/news/us-news/donald-trump-biopic-apprentice-release-date-set-ahead-2024-election-rcna168981
1flw4yh,Netanyahu Is Keeping a Hostage Deal as a 'Priceless Gift' for Trump's Return,WhatYouThinkYouSee,politics,265,80,1726897454.0,https://www.haaretz.com/opinion/2024-09-09/ty-article-opinion/.premium/netanyahu-is-keeping-a-hostage-deal-as-a-priceless-gift-for-trumps-return/00000191-d2b6-d83f-a3d9-dfff669f0000
1flvtpz,Human genome stored on 'everlasting' memory crystal,waozen,technology,57,3,1726896211.0,https://phys.org/news/2024-09-human-genome-everlasting-memory-crystal.html
1flbhss,"Trump is a threat to democracy. That's not rhetoric, it's verifiable fact | Editorial",njdotcom,politics,5937,214,1726837409.0,https://www.nj.com/opinion/2024/09/stop-warnings-that-trump-is-a-threat-to-democracy-no-chance-editorial.html?utm_medium=social&utm_source=redditsocial
1flr9jq,Your Guide to All the Political Sex Scandals of the Last 24 Hours,pacoshuman,politics,629,79,1726880023.0,https://www.washingtonian.com/2024/09/20/your-guide-to-all-the-political-sex-scandals-of-the-last-24-hours/
1fm2v3g,The Russian Bot Army That Conquered Online Poker,s1n0d3utscht3k,technology,13,3,1726924822.0,https://www.bloomberg.com/features/2024-poker-bots-artificial-intelligence-russia
1flhgcq,Local Teamsters groups announce Harris endorsements after national union declines to do so,nbcnews,politics,2498,46,1726852998.0,https://www.nbcnews.com/business/business-news/local-teamsters-groups-announce-harris-endorsements-national-union-dec-rcna171984
1fm90yi,Liz Cheney Suggests a New Political Party May Be Needed,drtolmn69,politics,28,18,1726941925.0,https://www.nytimes.com/2024/09/21/us/politics/liz-cheney-republican-party.html
1flp2hn,'She should be alive today' — Harris spotlights woman's death to blast abortion bans and Trump,G24all2read,politics,840,14,1726873307.0,https://apnews.com/article/harris-election-abortion-rights-georgia-amber-thurman-5ba5dabf0dc3c98de12389c34b47475d
1flfzwf,Opinion: I co-chaired Nikki Haley's Iowa campaign. I am endorsing Kamala Harris.,plz-let-me-in,politics,2820,46,1726849223.0,https://www.desmoinesregister.com/story/opinion/columnists/iowa-view/2024/09/20/republicans-for-kamala-harris-dawn-roberts-iowa-campaign-nikki-haley/75306017007/
1flm43m,Porn website posts reportedly linked to Robinson deleted after CNN story,WeirdProudAndHungry,politics,1233,131,1726865092.0,https://www.politico.com/news/2024/09/20/mark-robinson-porn-website-deleted-00180319
1flzvh3,Republicans step up effort to change Nebraska voting rules to help Trump | US elections 2024,Travelersofthewind,politics,100,20,1726914022.0,https://www.theguardian.com/us-news/2024/sep/21/republicans-nebraska-trump-electoral-college
1flza2e,California governor signs law to protect children from social media addiction,9OneOne_,politics,110,10,1726911401.0,https://apnews.com/article/california-social-media-addiction-children-law-bc649326701f892a16be1159bc008d71
1fluzpg,Trump is full of big ideas. Too bad they're such bad ones.,pleasureismylife,politics,280,37,1726892930.0,https://www.msnbc.com/opinion/msnbc-opinion/trump-policy-proposals-election-ideas-2024-rcna171633
1fm1fw1,LZ Experiment Sets New Record in Search for Dark Matter,fchung,technology,14,2,1726920171.0,https://newscenter.lbl.gov/2024/08/26/lz-experiment-sets-new-record-in-search-for-dark-matter/
1flkoda,"Tesla, SpaceX employees are donating to Harris despite Musk backing Trump",chrondotcom,politics,1375,71,1726861328.0,https://www.chron.com/culture/article/tesla-employees-harris-19776979.php
1fliurd,"What Trump Did to the G.O.P., Musk Did to Twitter",zaparthes,politics,1746,96,1726856572.0,https://www.nytimes.com/2024/09/20/opinion/trump-elon-musk-twitter-x.html
1fm97gb,Texas has spent more than $148 million busing migrants to other parts of the country,Advanced_Aspect_7601,politics,21,8,1726942423.0,https://www.texastribune.org/2024/02/21/texas-migrants-busing-cost-greg-abbott/
1fl3ouk,Cybertruck Owner’s Manual Says Its Hitch Is Only Designed To Support Vertical Loads Up To 160 Pounds,AccomplishedBrain309,technology,4900,292,1726805933.0,https://jalopnik.com/cybertruck-owner-s-manual-says-its-hitch-is-only-design-1851653010?utm_medium=sharefromsite&utm_source=jalopnik_reddit
1flxhtc,"Iran backdoors planted across Middle East telecoms, government agencies, Google says",Robert-Nogacki,technology,32,1,1726903318.0,https://therecord.media/iran-backdoors-planted-across-middle-east-telecoms-government-orgs
1flpo7g,Kamala Harris To Women Denied Abortion Care After Roe: 'We See You And You Are Not Alone',z8675309z,politics,646,8,1726875132.0,https://www.huffpost.com/entry/kamala-harris-women-denied-abortion-care-roe-we-see-you-and-you-are-not-alone_n_66ede416e4b07bdc7bac8c3e
1fla605,Democrats launch new ad push to tie Trump to Mark Robinson following reported porn website comments,Silent-Resort-3076,politics,5709,173,1726833337.0,https://www.nbcnews.com/politics/2024-election/democrats-launch-new-ad-push-tie-trump-mark-robinson-reported-porn-web-rcna171889
1fm3up0,How the top election official in America's biggest swing state is preparing for November,redditofthebanned,politics,47,4,1726927683.0,https://www.nbcnews.com/politics/2024-election/top-election-official-americas-biggest-swing-state-preparing-november-rcna171954
1fm9cbn,Kamala Harris Is All-In for a Second Debate,z8675309z,politics,19,4,1726942797.0,https://www.motherjones.com/politics/2024/09/kamala-harris-is-all-in-for-a-second-presidential-debate/
1fm95p9,"Harris accepts CNN debate invitation for October 23, again challenging Trump to another showdown",P_a_s_g_i_t_24,politics,20,20,1726942288.0,https://cnn.com/2024/09/21/politics/presidential-debate-harris-trump-cnn/index.html?09212024
1flmbnf,"Witnesses said Matt Gaetz attended a sex party with a 17-year-old girl, per latest court filings",bubs713,politics,953,38,1726865643.0,https://www.salon.com/2024/09/20/witnesses-said-matt-gaetz-attended-a-party-with-a-17-year-old-girl-per-latest-filings/
1fl9d4k,Kamala Harris has room to grow in the polls. Trump can’t say the same.,iymcool,politics,5991,239,1726830481.0,https://www.msnbc.com/opinion/msnbc-opinion/kamala-harris-trump-polls-debate-rcna171827
1flct8f,Harris Warns of Mass Deportations and Detention Camps if Trump Is Elected,CRTsdidnothingwrong,politics,3321,310,1726841049.0,https://www.nytimes.com/2024/09/18/us/politics/harris-immigration-deportation-trump.html
1flda9j,"In 2020, labelling Trump’s lies as ‘disputed’ on X made supporters believe them more — ‘We can’t pinpoint why disputed tags backfired among Trump voters, but distrust of the platform may have played a role’: study author",marketrent,technology,614,112,1726842295.0,https://www.theguardian.com/technology/2024/sep/20/trump-tweets-false-label-credibility-supporters
1flpydp,GOP scrambles to contain Robinson fallout in North Carolina,Cute-Perception2335,politics,538,69,1726875974.0,https://thehill.com/homenews/campaign/4891581-north-carolina-gubernatorial-candidate-mark-robinson
1fm4z3i,Saturday Morning Political Cartoon Thread,optimalg,politics,34,62,1726930868.0,https://www.reddit.com/r/politics/comments/1fm4z3i/saturday_morning_political_cartoon_thread/
1flnfcv,"In Mark Robinson’s fall, Republicans are getting what they asked for",NeonBumble,politics,772,29,1726868632.0,https://www.msnbc.com/opinion/msnbc-opinion/mark-robinson-republicans-north-carolina-porn-forum-rcna171979
1fm8e87,Election 2024 latest news: Trump to campaign in N.C. amid spotlight on GOP’s nominee for governor - The Washington Post,Beratungsmarketing,politics,18,9,1726940222.0,https://www.washingtonpost.com/elections/2024/09/21/2024-election-campaign-updates-harris-trump/
1fldf8h,Mark Robinson and the Republican Wackjob Problem,d-n-y-,politics,2826,179,1726842668.0,https://nymag.com/intelligencer/article/mark-robinson-and-the-republican-whackjob-problem.html
1flva2k,How Dumb Do They Think You Are?,fornuis,politics,198,33,1726894052.0,https://www.thebulwark.com/p/how-dumb-do-they-think-you-are
1fm5fd0,"In his hometown, Trump's alleged would-be assassin acted like he was 'above the law'",StuffMaster,politics,26,13,1726932123.0,https://www.npr.org/2024/09/20/g-s1-23844/ryan-routh-trump-assassion-attempt-suspect-golf-course-greensboro
1fkys83,Elon Musk officially moves X headquarters from California to Texas,abrownn,technology,10539,1380,1726790124.0,https://www.chron.com/culture/article/x-twitter-hq-texas-musk-19777426.php
1fm3du8,Election fears ignite 'preppers' already planning for the catastrophic unknown,cuspofgreatness,politics,39,51,1726926347.0,https://www.nbcnews.com/politics/politics-news/election-fears-ignite-preppers-already-planning-catastrophic-unknown-rcna170399
1fm8vnm,Elon Musk’s X Backs Down in Brazil,BertramPotts,politics,18,8,1726941535.0,https://www.nytimes.com/2024/09/21/world/americas/elon-musk-x-brazil.html?smid=tw-nytimes&smtyp=cur
1flgxh5,Trump Media plummets to new low on the first trading day the former president can sell his shares,CountyBeginning6510,politics,1705,189,1726851631.0,https://abcnews.go.com/Technology/wireStory/trump-media-plummets-new-low-trading-day-former-113874264
1flls6w,Trump has no plan to pull his endorsement of Mark Robinson after alleged porn site scandal,harleybarley1013,politics,895,113,1726864225.0,https://www.nbcnews.com/news/amp/rcna171988
1flo62i,Mark Robinson scandal  could send shockwaves through NC campaign trail,stark247,politics,635,71,1726870680.0,https://abc11.com/amp/post/mark-robinson-scandal-could-send-shockwaves-campaign-trail-key-battleground-state/15331709/
1flki8s,Intel shares pop on report Qualcomm has approached it about takeover,Georgeika,technology,193,75,1726860879.0,https://www.cnbc.com/2024/09/20/qualcomm-reportedly-approached-intel-about-takeover.html
1flbv8s,Using GPT-4 to generate 100 words consumes up to 3 bottles of water — AI data centers also raise power and water bills for nearby residents,UltraNooob,technology,531,175,1726838470.0,https://www.tomshardware.com/tech-industry/artificial-intelligence/using-gpt-4-to-generate-100-words-consumes-up-to-3-bottles-of-water-ai-data-centers-also-raise-power-and-water-bills-for-nearby-residents
1fm4g72,Clever Social Engineering Attack Using Captchas,BigIllustrator4131,technology,8,5,1726929382.0,https://isc.sans.edu/diary/rss/31282
1flaxfs,It’s easy to find misinformation on social media. It’s even easier on X. ,Wagamaga,technology,586,24,1726835728.0,https://www.poynter.org/fact-checking/2024/how-elon-musk-twitter-takeover-accelerated-misinformation/
1fla783,Bacteria on the space station are evolving for life in space,waozen,technology,405,52,1726833454.0,https://www.newscientist.com/article/2448437-bacteria-on-the-space-station-are-evolving-for-life-in-space/
1fl78ds,The EU still wants to scan your private chats,Martin_WK,technology,642,111,1726821247.0,https://www.techradar.com/computing/cyber-security/the-eu-still-wants-to-scan-your-private-chats-heres-what-you-can-do-about-it
1flpwlf,Qualcomm reportedly approached Intel about a takeover. Analysts say they could face political scrutiny and 'little overlap.',flintflower,technology,39,7,1726875827.0,https://www.businessinsider.com/intel-qualcomm-takeover-bid-layoffs-foundry-spin-off-2024-9
1fljc9t,NBA 2K25 Will Remove VC Packs In South Korea Due To Mandatory Disclosure Of Probability Information,esporx,technology,92,8,1726857865.0,https://twistedvoxel.com/nba-2k25-remove-vc-packs-mandatory-disclosure-probability-information-south-korea/
1fll9k2,Insecure software makers are the real cyber villains – CISA,FauxReal,technology,58,10,1726862861.0,https://www.theregister.com/2024/09/20/cisa_sloppy_vendors_cybercrime_villains/
1fkxgax,FTC Says Social Media Platforms Engage in 'Vast Surveillance' of Users,draggedbyatruck,technology,2973,115,1726786217.0,https://gizmodo.com/ftc-says-social-media-platforms-engage-in-vast-surveillance-of-users-2000500840
1flvm3u,Spyware Injection Into Your ChatGPT's Long-Term Memory (SpAIware),waozen,technology,12,0,1726895358.0,https://embracethered.com/blog/posts/2024/chatgpt-macos-app-persistent-data-exfiltration/
1fm86es,"Next Generation Developer Day - London, UK - 8th October. Free all day event to learn all about building with and using generative AI",094459,technology,1,0,1726939636.0,https://go.aws/3MQuQsO
1fl30i8,Ukraine’s Gun-Armed Ground 'Bot Just Cleared A Russian Trench In Kursk,Fit-Requirement6701,technology,1041,72,1726803557.0,https://www.forbes.com/sites/davidaxe/2024/09/19/ukraines-gun-armed-ground-robot-just-cleared-a-russian-trench-in-kursk/
1fl7j17,FTC report proves your social media surveillance paranoia is real,BobbyLucero,technology,349,43,1726822661.0,https://www.androidauthority.com/ftc-2024-report-social-media-surveillance-3483396/
1fkne95,Brazil threatens X with $900k daily fine for circumventing ban | Semafor,crates-of-bigfoots,technology,10917,786,1726759116.0,https://www.semafor.com/article/09/19/2024/elon-musks-x-restores-service-in-brazil-despite-ban
1flnh38,Senate Vote Could Give Helping Hand To Patent Trolls,Anoth3rDude,technology,32,5,1726868763.0,https://www.eff.org/deeplinks/2024/09/senate-vote-tomorrow-could-give-helping-hand-patent-trolls
1flbhaw,Apple put on notice over support for third-party watches and headphones,traffic-robot,technology,113,60,1726837367.0,https://www.theverge.com/2024/9/20/24249738/eu-dma-apple-ios-iphone-interoperability-smartwatches-headphones
1fm3nux,"Interesting Engineering: Pudu unveils super semi-humanoid robot with 8-hour battery, 10kg lift power",BothZookeepergame612,technology,1,17,1726927160.0,https://interestingengineering.com/innovation/pudu-d7-semi-humanoid-robot
1flig3z,"Chinese ""typhoon"" hackers threaten U.S. infrastructure",Fit-Requirement6701,technology,35,5,1726855528.0,https://www.axios.com/2024/09/20/china-critical-infrastructure-cyberattacks
1flzfv3,IBM Reduces Workforce: The Impact of AI on Employment,LollipopChainsawZz,technology,2,8,1726912144.0,https://nayrabizsphere.com/2024/09/ibms-ai-strategy-leads-to-job-cuts/
1fllh7d,Unique Combination of Microbes Could Treat Antibiotic-Resistant Infections | Technology Networks,FollowTheLeads,technology,24,1,1726863428.0,https://www.technologynetworks.com/immunology/news/unique-combination-of-microbes-could-treat-antibiotic-resistant-infections-391189
1fl9z12,Mistrial declared for ex-AT&T exec accused of bribing government official,AdSpecialist6598,technology,98,4,1726832681.0,https://arstechnica.com/tech-policy/2024/09/mistrial-declared-for-ex-att-exec-accused-of-bribing-government-official/
1fkj7sc,Palworld maker vows to fight Nintendo lawsuit on behalf of fans and indie developers,ardi62,technology,8561,938,1726747720.0,https://www.eurogamer.net/palworld-developer-vows-to-fight-nintendo-lawsuit-on-behalf-of-fans-and-indie-developers
1fkyleg,Chipmaker Qualcomm lays off hundreds of workers in San Diego,McFatty7,technology,852,81,1726789556.0,https://techcrunch.com/2024/09/19/chipmaker-qualcomm-lays-off-hundreds-of-workers-in-san-diego/
1flt36u,"Lawson to work with KDDI, M'bishi Corp. to open 'convenience stores of the future' in Japan ",Saltedline,technology,6,3,1726886163.0,https://mainichi.jp/english/articles/20240920/p2a/00m/0bu/021000c
1fl2xg4,Exploding Pagers Sound Global Alarm for Supply-Chain Security,caveatlector73,technology,396,447,1726803265.0,https://www.bloomberg.com/news/articles/2024-09-19/exploding-pagers-sound-global-alarm-for-supply-chain-security?srnd=phx-technology
1flgcik,Former Snap Spectacles engineer says the new glasses are ‘obviously bad’,lurker_bee,technology,30,8,1726850121.0,https://www.theverge.com/2024/9/20/24249807/snap-spectacles-ar-glasses-developer-bad-comment
1fkldkx,Iranian Hackers Tried to Tempt Biden’s Campaign With Stolen Trump Info | Hackers have been shopping the information around since the summer when they successfully spear phished a former senior campaign advisor.,chrisdh79,technology,3936,186,1726753914.0,https://gizmodo.com/iranian-hackers-tried-to-tempt-bidens-campaign-with-stolen-trump-info-2000500701
1fkvqak,LinkedIn scraping user content for its AI without asking,jluizsouzadev,technology,936,67,1726781471.0,https://www.theregister.com/2024/09/19/linkedin_ai_data_access/?td=rt-3a
