id,title,author,subreddit,score,num_comments,created_utc,url,website_source,sub_categories
1fm83my,Mike Lindell Group Accused of 'Impersonating' Election Cybersecurity Initiative,Titfortat101,politics,68,9,2024-09-21 17:23:49,https://www.rollingstone.com/politics/politics-features/mike-lindell-group-accused-impersonating-election-cybersecurity-1235102625/,www.rollingstone.com,politics
1flggy4,"
MAGA Republicans Pass New Election Rules in Georgia That Could Rig the State for Trump | 
“We’re so far off the deep end of sanity here.”",Murky-Site7468,politics,7186,369,2024-09-20 16:40:42,https://www.motherjones.com/politics/2024/09/repbulican-georgia-election-board-hand-count-rules-election-chaos/,www.motherjones.com,politics
1flbn9m,"Trump Suddenly Behind in Must-Win Pennsylvania, Four New Polls Show
",alexapaul11,politics,26601,1765,2024-09-20 13:10:46,https://newrepublic.com/article/186182/trump-suddenly-behind-must-win-pennsylvania-four-new-polls-show,newrepublic.com,article
1flaf75,"Amazon says workers need to be in the office. Most of Silicon Valley disagrees — Only 3 per cent of tech companies with more than 25,000 employees are back to five days in the office: Flex Index",marketrent,technology,3119,110,2024-09-20 12:09:08,https://www.ft.com/content/c7b82efc-9174-4fc0-8f06-6c6a884d5105,www.ft.com,content
1fm2u09,Donald Trump Says Women Will Be 'Happy' and 'Great Again' if He Wins,fornuis,politics,146,158,2024-09-21 13:18:50,https://www.newsweek.com/donald-trump-women-happy-great-again-wins-abortion-1957288,www.newsweek.com,donald-trump-women-happy-great-again-wins-abortion-1957288
1flpiz7,Walz debate prep underway with Pete Buttigieg as Vance stand-in,ubcstaffer123,politics,1832,231,2024-09-20 23:24:47,https://abcnews.go.com/Politics/walz-debate-prep-underway-pete-buttigieg-vance-stand/story?id=113872808,abcnews.go.com,Politics
1fm2zuj,"Euphoric two years ago, US anti-abortion movement is now divided and worried as election nears",SpaceElevatorMusic,politics,139,24,2024-09-21 13:26:55,https://apnews.com/article/anti-abortion-election-2024-roe-v-wade-62364f84be8c1a9fd112b1f3fa0870ae,apnews.com,article
1flwcow,Republicans Are Struggling to Raise Money to Compete With Democrats,Silly-avocatoe,politics,539,72,2024-09-21 05:59:28,https://newrepublic.com/post/186227/republicans-money-struggle-lara-trump,newrepublic.com,post
1fls1li,"Court rules nearly 98,000 Arizonans whose citizenship hadn't been confirmed can vote the full ballot",karmaisourfriend,politics,1204,84,2024-09-21 01:37:05,https://apnews.com/article/15703fd0ee76359af0eb1b7539df1cc7,apnews.com,article
1fm74g6,Trump shared a fake image to smear Harris with the shocking allegations against Diddy,InternetPopular3679,politics,74,14,2024-09-21 16:40:02,https://www.msnbc.com/top-stories/latest/trump-kamala-harris-diddy-sean-combs-fake-image-rcna172088,www.msnbc.com,top-stories
1fm5fhw,"As President, Trump Demanded Investigations of Foes. He Often Got Them. ",heavenlysoulraj,politics,89,12,2024-09-21 15:22:14,https://www.nytimes.com/2024/09/21/us/politics/trump-investigations-enemies.html?unlocked_article_code=1.MU4.rNHn.5Eirp0cBZLAQ,www.nytimes.com,2024
1fljvju,Fact check: Springfield had more murders under Trump than under Biden-Harris,plz-let-me-in,politics,3739,71,2024-09-20 19:07:13,https://www.cnn.com/2024/09/20/politics/fact-check-springfield-had-more-murders-under-trump-than-under-biden-harris/index.html,www.cnn.com,2024
1flaaf9,Matt Gaetz Was at Sex and Drugs Party With High School Junior: Docs,HandSack135,politics,32603,1065,2024-09-20 12:02:09,https://www.thedailybeast.com/matt-gaetz-was-at-sex-and-drugs-party-with-high-school-junior-court-docs,www.thedailybeast.com,matt-gaetz-was-at-sex-and-drugs-party-with-high-school-junior-court-docs
1fm7khh,"'This is the moment': Oprah Winfrey, Chris Rock and other celebs rally for Kamala Harris",its_Ghanou,politics,68,19,2024-09-21 16:59:52,https://www.usatoday.com/story/news/politics/elections/2024/09/19/oprah-winfrey-chris-rock-and-other-celebs-rally-for-kamala-harris/75299547007/,www.usatoday.com,story
1flvcbv,Final Fantasy 16 producer Naoki Yoshida asks that modders please don't run amok with 'offensive or inappropriate' shenanigans now the game's on PC,LollipopChainsawZz,technology,119,52,2024-09-21 04:51:43,https://www.pcgamer.com/games/rpg/final-fantasy-16-director-naoki-yoshida-asks-that-modders-please-dont-run-amok-with-offensive-or-inappropriate-shenanigans-now-the-games-on-pc/,www.pcgamer.com,games
1fm8n0a,Harris accepts CNN offer for 2nd presidential debate on Oct. 23,Ace-Cuddler,politics,56,12,2024-09-21 17:47:54,https://abcnews.go.com/Politics/harris-accepts-cnn-offer-2nd-presidential-debate-oct/story?id=113899130,abcnews.go.com,Politics
1fm6xi7,"Harris accepts CNN invitation to second debate, urges Trump to join",No-Attitude-6049,politics,67,10,2024-09-21 16:30:59,https://www.reuters.com/world/us/harris-accepts-cnn-invitation-second-debate-urges-trump-join-2024-09-21/,www.reuters.com,world
1fm663t,Harris campaign lays out its Mark Robinson strategy in North Carolina,Kiss_My_Wookiee,politics,76,13,2024-09-21 15:56:21,https://www.politico.com/news/2024/09/21/harris-memo-mark-robinson-nc-strategy-00180357,www.politico.com,news
1fm88vq,OpenAI staffers reportedly 'taken aback' by 'ominous' logo rebranding | The company is reportedly switch its current logo for one that looks like a black 'O.',MetaKnowing,technology,11,6,2024-09-21 17:30:18,https://www.engadget.com/ai/openai-staffers-reportedly-taken-aback-by-ominous-logo-rebranding-160017936.html,www.engadget.com,ai
1fm4npu,Republicans Boost Jill Stein as Potential Harris Spoiler,ishtar_the_move,politics,90,82,2024-09-21 14:46:16,https://www.wsj.com/politics/elections/jill-stein-republican-support-harris-voters-5a194ebf?mod=hp_lead_pos6,www.wsj.com,politics
1fm4f5w,What Trump has promised to do on ‘day one’ as president ,washingtonpost,politics,87,38,2024-09-21 14:35:02,https://www.washingtonpost.com/politics/2024/09/21/trump-day-one-promises-president-election/?utm_campaign=wp_main&utm_medium=social&utm_source=reddit.com,www.washingtonpost.com,politics
1fm0m09,"Man, The Senate Judiciary Committee Is Broken",cram213,politics,161,10,2024-09-21 11:11:07,https://www.huffpost.com/entry/maya-berry-john-kennedy-senate-judiciary-committee_n_66eddfaae4b07dd371cccc9e,www.huffpost.com,entry
1fm6oqy,Harris triples Trump’s fundraising in August as campaigns approach final stretch,its_Ghanou,politics,67,9,2024-09-21 16:19:42,https://www.washingtonexaminer.com/news/campaigns/presidential/3162246/harris-triples-trump-fundraising-august-campaigns-approach-final-stretch/,www.washingtonexaminer.com,news
1fl2j0y,23andMe faces Nasdaq delisting after its entire board resigns,ChocolateTsar,technology,18263,977,2024-09-20 03:11:26,https://www.cnbc.com/video/2024/09/19/23andme-facing-nasdaq-delisting-after-entire-board-resigns.html,www.cnbc.com,video
1fl95ev,Ted Cruz Losing to Colin Allred for First Time: Texas Poll,Coffee_n_wifi,politics,38036,1398,2024-09-20 10:55:19,https://www.newsweek.com/ted-cruz-losing-colin-allred-first-time-texas-poll-us-senate-election-1956711,www.newsweek.com,ted-cruz-losing-colin-allred-first-time-texas-poll-us-senate-election-1956711
1flw0e9,"Trump’s threats to ‘go after’ opponents will subvert rule of law, experts warn ",caveatlector73,politics,436,48,2024-09-21 05:35:47,https://www.theguardian.com/us-news/2024/sep/20/trump-election-opponents-threats,www.theguardian.com,us-news
1fm5g74,"Court rules nearly 98,000 Arizonans whose citizenship hadn’t been confirmed can vote the full ballot",bummed_athlete,politics,74,13,2024-09-21 15:23:08,https://www.politico.com/news/2024/09/20/court-rules-nearly-98-000-arizonans-whose-citizenship-hadnt-been-confirmed-can-vote-the-full-ballot-00180354,www.politico.com,news
1fluq63,Thousands turn out in Fairfax Co. for first day of early voting in Va.,fornuis,politics,544,34,2024-09-21 04:12:14,https://wtop.com/virginia/2024/09/thousands-turn-out-in-fairfax-co-for-first-day-of-early-voting-in-va/,wtop.com,virginia
1flg7n0,Congress Poised To Bring Back Unfettered Patent Trolling,Fit-Requirement6701,technology,957,52,2024-09-20 16:29:35,https://abovethelaw.com/2024/09/congress-poised-to-bring-back-unfettered-patent-trolling/,abovethelaw.com,2024
1fm03zb,‘People need to see it’: How politics hung up a $42B Biden internet buildout,jecht8,politics,162,7,2024-09-21 10:36:55,https://www.politico.com/news/2024/09/04/biden-broadband-program-swing-state-frustrations-00175845,www.politico.com,news
1fm9147,"Trump Makes Shocking Decision on Scandal-Ridden Mark Robinson | 
Turns out, Mark Robinson still hasn’t done enough to turn off Donald Trump.",Murky-Site7468,politics,42,18,2024-09-21 18:05:37,https://newrepublic.com/post/186223/donald-trump-mark-robinson-scandal-decision,newrepublic.com,post
1fm8fla,Arizona Supreme Court rules nearly 100K can receive full ballots without citizenship proof,MobileWisdom,politics,45,15,2024-09-21 17:38:42,https://thehill.com/regulation/court-battles/4892271-arizona-supreme-court-citizenship-ballot/,thehill.com,regulation
1flvcg0,Mark Robinson's mistake with MAGA: Not owning his pro-Hitler posts,elliottbaytrail,politics,422,44,2024-09-21 04:51:57,https://www.salon.com/2024/09/21/mark-robinsons-big-mistake-with-maga-being-afraid-to-own-his-pro-hitler-posts/,www.salon.com,2024
1fm0gr8,"Court rules nearly 98,000 Arizonans whose citizenship hadn't been confirmed can vote the full ballot",BobbyLucero,politics,139,14,2024-09-21 11:01:34,https://apnews.com/article/arizona-voter-citizenship-proof-elections-court-15703fd0ee76359af0eb1b7539df1cc7,apnews.com,article
1fm5sc2,Lies About Immigration Help No One,theatlantic,politics,57,11,2024-09-21 15:38:55,https://www.theatlantic.com/politics/archive/2024/09/springfield-trump-vance-lies-immigrants/679959/?utm_source=reddit&utm_medium=social&utm_campaign=the-atlantic&utm_content=edit-promo,www.theatlantic.com,politics
1fm7c3t,Texas Attorney General’s office sues Harris County over revised basic income program. Paxton earlier this year struck down the county’s efforts to provide monthly stipends to lower-income families. He requested the state prohibit payments under the county’s pilot guaranteed income program.,southpawFA,politics,43,13,2024-09-21 16:49:24,https://www.houstonpublicmedia.org/articles/news/harris-county/2024/09/19/500409/texas-attorney-generals-office-again-sues-harris-county-over-proposed-basic-income-program/,www.houstonpublicmedia.org,articles
1fm0jg7,"Harris’ cash edge funds advertising blitz as Elon Musk cuts big check to House Republicans, new filings show",trifecta,politics,124,13,2024-09-21 11:06:26,https://www.cnn.com/2024/09/21/politics/fundraising-harris-trump-elon-musk/index.html?utm_medium=social&utm_source=blueskyCNN&utm_content=2024-09-21T10%3A40%3A47,www.cnn.com,2024
1flx2n9,Trump Still Silent on Mark Robinson as Republicans Speak Out,vsandrei,politics,272,36,2024-09-21 06:51:15,https://www.newsweek.com/trump-still-silent-mark-robinson-republicans-speak-out-1957266,www.newsweek.com,trump-still-silent-mark-robinson-republicans-speak-out-1957266
1flej0j,Anker recalls three power banks due to fire risk - stop using them now,lurker_bee,technology,968,74,2024-09-20 15:18:20,https://www.zdnet.com/home-and-office/energy/anker-recalls-three-power-banks-due-to-fire-risk-stop-using-them-now/,www.zdnet.com,home-and-office
1fm466r,Donald Trump Says Women Will Be ‘Happy and Great Again’ If He Wins,Quirkie,politics,73,34,2024-09-21 14:23:08,https://www.thedailybeast.com/donald-trump-says-women-will-be-happy-and-great-again-if-he-wins,www.thedailybeast.com,donald-trump-says-women-will-be-happy-and-great-again-if-he-wins
1fld83s,'I haven't seen it': GOP lawmaker admits he had no evidence to back up voting fraud claims,tigermountains,politics,5823,143,2024-09-20 14:22:17,https://www.msnbc.com/morning-joe/watch/-i-haven-t-seen-it-gop-lawmaker-admits-he-had-no-evidence-to-back-up-voting-fraud-claims-219779141992,www.msnbc.com,morning-joe
1flr080,Lewd posts by Trump-backed candidate for NC governor removed from porn forum,tuftedear,politics,813,72,2024-09-21 00:39:45,https://www.cnn.com/2024/09/20/politics/posts-removed-porn-forum-mark-robinson-north-carolina-kfile/index.html,www.cnn.com,2024
1fm7b9w,Hillary Clinton says Vance’s child care comments are ‘not in touch’ with most Americans’ lives,aslan_is_on_the_move,politics,42,14,2024-09-21 16:48:20,https://www.cnn.com/2024/09/19/politics/hillary-clinton-jd-vance-child-care/,www.cnn.com,2024
1fm8724,Harris accepts invitation for second potential debate in October,nbcnews,politics,35,3,2024-09-21 17:28:05,https://www.nbcnews.com/politics/2024-election/harris-accepts-invitation-second-debate-october-rcna172104,www.nbcnews.com,politics
1floi98,Porn site user linked to Mark Robinson also praised Hitler’s Mein Kampf,mymomknowsyourmom,politics,1055,50,2024-09-20 22:34:14,https://www.washingtonpost.com/politics/2024/09/20/mark-robinson-mein-kampf-porn-posts/,www.washingtonpost.com,politics
1fm7vjg,How influencers flocked to Springfield chasing debunked rumors and attention,npr,politics,35,13,2024-09-21 17:13:22,https://www.npr.org/2024/09/20/nx-s1-5112682/springfield-influencers-haitian-immigrants-social-media-trump,www.npr.org,2024
1flakx9,"Trump says if he loses to Harris, ""Jewish people would have a lot to do"" with it",etfvfva,politics,7529,922,2024-09-20 12:17:31,https://www.axios.com/2024/09/20/trump-jewish-voters-antisemitism-election,www.axios.com,2024
1flggnc,Brazil Supreme Court fines X over noncompliance with suspension order,Wagamaga,technology,623,20,2024-09-20 16:40:19,https://www.jurist.org/news/2024/09/brazil-supreme-court-fines-x-over-noncompliance-with-suspension-order/,www.jurist.org,news
1fm7e1r,Georgia election board approves controversial rule change requiring ballots be hand-counted,Severe_County_5041,politics,40,19,2024-09-21 16:51:54,https://abcnews.go.com/Politics/georgia-election-board-approves-controversial-rule-change-requiring/story?id=113876120&cid=social_twitter_abcn,abcnews.go.com,Politics
1flf06d,Robinson will not appear at Trump’s North Carolina rally after report on alleged online comments,theombudsmen,politics,3729,251,2024-09-20 15:38:27,https://apnews.com/article/north-carolina-governor-mark-robinson-trump-kamala-harris-cooper-cnn-stein-c7ee5c23f554f3708619d6b68e208b94,apnews.com,article
1fl8saj,The Deaths of Two Mothers in Georgia Show That Ending Roe Was Never About “Life”,Murky-Site7468,politics,11527,145,2024-09-20 10:30:40,https://slate.com/news-and-politics/2024/09/supreme-court-abortion-ban-roe-life-lie.html?pay=1726827826959&support_journalism=please,slate.com,news-and-politics
1flu6vx,Donald Trump biopic 'The Apprentice' sets pre-election release date,duedate2010,politics,387,23,2024-09-21 03:40:16,https://www.nbcnews.com/news/us-news/donald-trump-biopic-apprentice-release-date-set-ahead-2024-election-rcna168981,www.nbcnews.com,news
1flw4yh,Netanyahu Is Keeping a Hostage Deal as a 'Priceless Gift' for Trump's Return,WhatYouThinkYouSee,politics,265,80,2024-09-21 05:44:14,https://www.haaretz.com/opinion/2024-09-09/ty-article-opinion/.premium/netanyahu-is-keeping-a-hostage-deal-as-a-priceless-gift-for-trumps-return/00000191-d2b6-d83f-a3d9-dfff669f0000,www.haaretz.com,opinion
1flvtpz,Human genome stored on 'everlasting' memory crystal,waozen,technology,57,3,2024-09-21 05:23:31,https://phys.org/news/2024-09-human-genome-everlasting-memory-crystal.html,phys.org,news
1flbhss,"Trump is a threat to democracy. That's not rhetoric, it's verifiable fact | Editorial",njdotcom,politics,5937,214,2024-09-20 13:03:29,https://www.nj.com/opinion/2024/09/stop-warnings-that-trump-is-a-threat-to-democracy-no-chance-editorial.html?utm_medium=social&utm_source=redditsocial,www.nj.com,opinion
1flr9jq,Your Guide to All the Political Sex Scandals of the Last 24 Hours,pacoshuman,politics,629,79,2024-09-21 00:53:43,https://www.washingtonian.com/2024/09/20/your-guide-to-all-the-political-sex-scandals-of-the-last-24-hours/,www.washingtonian.com,2024
1fm2v3g,The Russian Bot Army That Conquered Online Poker,s1n0d3utscht3k,technology,13,3,2024-09-21 13:20:22,https://www.bloomberg.com/features/2024-poker-bots-artificial-intelligence-russia,www.bloomberg.com,features
1flhgcq,Local Teamsters groups announce Harris endorsements after national union declines to do so,nbcnews,politics,2498,46,2024-09-20 17:23:18,https://www.nbcnews.com/business/business-news/local-teamsters-groups-announce-harris-endorsements-national-union-dec-rcna171984,www.nbcnews.com,business
1fm90yi,Liz Cheney Suggests a New Political Party May Be Needed,drtolmn69,politics,28,18,2024-09-21 18:05:25,https://www.nytimes.com/2024/09/21/us/politics/liz-cheney-republican-party.html,www.nytimes.com,2024
1flp2hn,'She should be alive today' — Harris spotlights woman's death to blast abortion bans and Trump,G24all2read,politics,840,14,2024-09-20 23:01:47,https://apnews.com/article/harris-election-abortion-rights-georgia-amber-thurman-5ba5dabf0dc3c98de12389c34b47475d,apnews.com,article
1flfzwf,Opinion: I co-chaired Nikki Haley's Iowa campaign. I am endorsing Kamala Harris.,plz-let-me-in,politics,2820,46,2024-09-20 16:20:23,https://www.desmoinesregister.com/story/opinion/columnists/iowa-view/2024/09/20/republicans-for-kamala-harris-dawn-roberts-iowa-campaign-nikki-haley/75306017007/,www.desmoinesregister.com,story
1flm43m,Porn website posts reportedly linked to Robinson deleted after CNN story,WeirdProudAndHungry,politics,1233,131,2024-09-20 20:44:52,https://www.politico.com/news/2024/09/20/mark-robinson-porn-website-deleted-00180319,www.politico.com,news
1flzvh3,Republicans step up effort to change Nebraska voting rules to help Trump | US elections 2024,Travelersofthewind,politics,100,20,2024-09-21 10:20:22,https://www.theguardian.com/us-news/2024/sep/21/republicans-nebraska-trump-electoral-college,www.theguardian.com,us-news
1flza2e,California governor signs law to protect children from social media addiction,9OneOne_,politics,110,10,2024-09-21 09:36:41,https://apnews.com/article/california-social-media-addiction-children-law-bc649326701f892a16be1159bc008d71,apnews.com,article
1fluzpg,Trump is full of big ideas. Too bad they're such bad ones.,pleasureismylife,politics,280,37,2024-09-21 04:28:50,https://www.msnbc.com/opinion/msnbc-opinion/trump-policy-proposals-election-ideas-2024-rcna171633,www.msnbc.com,opinion
1fm1fw1,LZ Experiment Sets New Record in Search for Dark Matter,fchung,technology,14,2,2024-09-21 12:02:51,https://newscenter.lbl.gov/2024/08/26/lz-experiment-sets-new-record-in-search-for-dark-matter/,newscenter.lbl.gov,2024
1flkoda,"Tesla, SpaceX employees are donating to Harris despite Musk backing Trump",chrondotcom,politics,1375,71,2024-09-20 19:42:08,https://www.chron.com/culture/article/tesla-employees-harris-19776979.php,www.chron.com,culture
1fliurd,"What Trump Did to the G.O.P., Musk Did to Twitter",zaparthes,politics,1746,96,2024-09-20 18:22:52,https://www.nytimes.com/2024/09/20/opinion/trump-elon-musk-twitter-x.html,www.nytimes.com,2024
1fm97gb,Texas has spent more than $148 million busing migrants to other parts of the country,Advanced_Aspect_7601,politics,21,8,2024-09-21 18:13:43,https://www.texastribune.org/2024/02/21/texas-migrants-busing-cost-greg-abbott/,www.texastribune.org,2024
1fl3ouk,Cybertruck Owner’s Manual Says Its Hitch Is Only Designed To Support Vertical Loads Up To 160 Pounds,AccomplishedBrain309,technology,4900,292,2024-09-20 04:18:53,https://jalopnik.com/cybertruck-owner-s-manual-says-its-hitch-is-only-design-1851653010?utm_medium=sharefromsite&utm_source=jalopnik_reddit,jalopnik.com,cybertruck-owner-s-manual-says-its-hitch-is-only-design-1851653010
1flxhtc,"Iran backdoors planted across Middle East telecoms, government agencies, Google says",Robert-Nogacki,technology,32,1,2024-09-21 07:21:58,https://therecord.media/iran-backdoors-planted-across-middle-east-telecoms-government-orgs,therecord.media,iran-backdoors-planted-across-middle-east-telecoms-government-orgs
1flpo7g,Kamala Harris To Women Denied Abortion Care After Roe: 'We See You And You Are Not Alone',z8675309z,politics,646,8,2024-09-20 23:32:12,https://www.huffpost.com/entry/kamala-harris-women-denied-abortion-care-roe-we-see-you-and-you-are-not-alone_n_66ede416e4b07bdc7bac8c3e,www.huffpost.com,entry
1fla605,Democrats launch new ad push to tie Trump to Mark Robinson following reported porn website comments,Silent-Resort-3076,politics,5709,173,2024-09-20 11:55:37,https://www.nbcnews.com/politics/2024-election/democrats-launch-new-ad-push-tie-trump-mark-robinson-reported-porn-web-rcna171889,www.nbcnews.com,politics
1fm3up0,How the top election official in America's biggest swing state is preparing for November,redditofthebanned,politics,47,4,2024-09-21 14:08:03,https://www.nbcnews.com/politics/2024-election/top-election-official-americas-biggest-swing-state-preparing-november-rcna171954,www.nbcnews.com,politics
1fm9cbn,Kamala Harris Is All-In for a Second Debate,z8675309z,politics,19,4,2024-09-21 18:19:57,https://www.motherjones.com/politics/2024/09/kamala-harris-is-all-in-for-a-second-presidential-debate/,www.motherjones.com,politics
1fm95p9,"Harris accepts CNN debate invitation for October 23, again challenging Trump to another showdown",P_a_s_g_i_t_24,politics,20,20,2024-09-21 18:11:28,https://cnn.com/2024/09/21/politics/presidential-debate-harris-trump-cnn/index.html?09212024,cnn.com,2024
1flmbnf,"Witnesses said Matt Gaetz attended a sex party with a 17-year-old girl, per latest court filings",bubs713,politics,953,38,2024-09-20 20:54:03,https://www.salon.com/2024/09/20/witnesses-said-matt-gaetz-attended-a-party-with-a-17-year-old-girl-per-latest-filings/,www.salon.com,2024
1fl9d4k,Kamala Harris has room to grow in the polls. Trump can’t say the same.,iymcool,politics,5991,239,2024-09-20 11:08:01,https://www.msnbc.com/opinion/msnbc-opinion/kamala-harris-trump-polls-debate-rcna171827,www.msnbc.com,opinion
1flct8f,Harris Warns of Mass Deportations and Detention Camps if Trump Is Elected,CRTsdidnothingwrong,politics,3321,310,2024-09-20 14:04:09,https://www.nytimes.com/2024/09/18/us/politics/harris-immigration-deportation-trump.html,www.nytimes.com,2024
1flda9j,"In 2020, labelling Trump’s lies as ‘disputed’ on X made supporters believe them more — ‘We can’t pinpoint why disputed tags backfired among Trump voters, but distrust of the platform may have played a role’: study author",marketrent,technology,614,112,2024-09-20 14:24:55,https://www.theguardian.com/technology/2024/sep/20/trump-tweets-false-label-credibility-supporters,www.theguardian.com,technology
1flpydp,GOP scrambles to contain Robinson fallout in North Carolina,Cute-Perception2335,politics,538,69,2024-09-20 23:46:14,https://thehill.com/homenews/campaign/4891581-north-carolina-gubernatorial-candidate-mark-robinson,thehill.com,homenews
1fm4z3i,Saturday Morning Political Cartoon Thread,optimalg,politics,34,62,2024-09-21 15:01:08,https://www.reddit.com/r/politics/comments/1fm4z3i/saturday_morning_political_cartoon_thread/,www.reddit.com,r
1flnfcv,"In Mark Robinson’s fall, Republicans are getting what they asked for",NeonBumble,politics,772,29,2024-09-20 21:43:52,https://www.msnbc.com/opinion/msnbc-opinion/mark-robinson-republicans-north-carolina-porn-forum-rcna171979,www.msnbc.com,opinion
1fm8e87,Election 2024 latest news: Trump to campaign in N.C. amid spotlight on GOP’s nominee for governor - The Washington Post,Beratungsmarketing,politics,18,9,2024-09-21 17:37:02,https://www.washingtonpost.com/elections/2024/09/21/2024-election-campaign-updates-harris-trump/,www.washingtonpost.com,elections
1fldf8h,Mark Robinson and the Republican Wackjob Problem,d-n-y-,politics,2826,179,2024-09-20 14:31:08,https://nymag.com/intelligencer/article/mark-robinson-and-the-republican-whackjob-problem.html,nymag.com,intelligencer
1flva2k,How Dumb Do They Think You Are?,fornuis,politics,198,33,2024-09-21 04:47:32,https://www.thebulwark.com/p/how-dumb-do-they-think-you-are,www.thebulwark.com,p
1fm5fd0,"In his hometown, Trump's alleged would-be assassin acted like he was 'above the law'",StuffMaster,politics,26,13,2024-09-21 15:22:03,https://www.npr.org/2024/09/20/g-s1-23844/ryan-routh-trump-assassion-attempt-suspect-golf-course-greensboro,www.npr.org,2024
1fkys83,Elon Musk officially moves X headquarters from California to Texas,abrownn,technology,10539,1380,2024-09-19 23:55:24,https://www.chron.com/culture/article/x-twitter-hq-texas-musk-19777426.php,www.chron.com,culture
1fm3du8,Election fears ignite 'preppers' already planning for the catastrophic unknown,cuspofgreatness,politics,39,51,2024-09-21 13:45:47,https://www.nbcnews.com/politics/politics-news/election-fears-ignite-preppers-already-planning-catastrophic-unknown-rcna170399,www.nbcnews.com,politics
1fm8vnm,Elon Musk’s X Backs Down in Brazil,BertramPotts,politics,18,8,2024-09-21 17:58:55,https://www.nytimes.com/2024/09/21/world/americas/elon-musk-x-brazil.html?smid=tw-nytimes&smtyp=cur,www.nytimes.com,2024
1flgxh5,Trump Media plummets to new low on the first trading day the former president can sell his shares,CountyBeginning6510,politics,1705,189,2024-09-20 17:00:31,https://abcnews.go.com/Technology/wireStory/trump-media-plummets-new-low-trading-day-former-113874264,abcnews.go.com,Technology
1flls6w,Trump has no plan to pull his endorsement of Mark Robinson after alleged porn site scandal,harleybarley1013,politics,895,113,2024-09-20 20:30:25,https://www.nbcnews.com/news/amp/rcna171988,www.nbcnews.com,news
1flo62i,Mark Robinson scandal  could send shockwaves through NC campaign trail,stark247,politics,635,71,2024-09-20 22:18:00,https://abc11.com/amp/post/mark-robinson-scandal-could-send-shockwaves-campaign-trail-key-battleground-state/15331709/,abc11.com,amp
