id,title,author,subreddit,score,num_comments,created_utc,url,website_source,sub_categories
1fm4tt7,"Trump to women: Stop ‘thinking about abortion.’ You’re broke and depressed, but I can make you happy",njdotcom,politics,11395,944,2024-09-21 14:54:23,https://www.nj.com/politics/2024/09/trump-to-women-youre-broke-and-depressed-but-i-can-make-you-happy.html,www.nj.com,politics
1fm20ee,Vaporizing plastics recycles them into nothing but gas,AdSpecialist6598,technology,2953,406,2024-09-21 12:35:34,https://arstechnica.com/science/2024/09/vaporizing-plastics-recycles-them-into-nothing-but-gas/,arstechnica.com,science
1flzkzc,"Voter registration is spiking, particularly among young adults",Cute-Perception2335,politics,14515,595,2024-09-21 10:00:12,https://www.usatoday.com/story/news/politics/elections/2024/09/21/young-voter-registration-breaking-records-swift/75306021007/,www.usatoday.com,story
1fm1pb1,America sort of likes Kamala Harris – and that might just be enough,flintflower,politics,6607,638,2024-09-21 12:18:17,https://www.businessinsider.com/kamala-harris-favorability-polls-reverse-trump-election-2024-9,www.businessinsider.com,kamala-harris-favorability-polls-reverse-trump-election-2024-9
1fm0dyg,A dramatic rise in pregnant women dying in Texas after abortion ban,redditofthebanned,politics,6477,357,2024-09-21 10:56:30,https://www.nbcnews.com/health/womens-health/texas-abortion-ban-deaths-pregnant-women-sb8-analysis-rcna171631,www.nbcnews.com,health
1fm6yi5,"Harris accepts CNN debate invitation for October 23, again challenging Trump to another showdown",coasterghost,politics,2143,251,2024-09-21 16:32:15,https://www.cnn.com/2024/09/21/politics/presidential-debate-harris-trump-cnn?cid=ios_app,www.cnn.com,2024
1flo3kf,Trump shares fake photo of Harris with Diddy in now-deleted Truth Social post,Fit-Requirement6701,technology,29925,1313,2024-09-20 22:14:47,https://www.nbcnews.com/news/amp/rcna171993,www.nbcnews.com,news
1fm7czs,"Married RFK Jr., 70, Bragged He Had ‘Intimate’ Photos of Reporter Olivia Nuzzi, 31",dustin91,politics,1918,229,2024-09-21 16:50:31,https://www.thedailybeast.com/married-rfk-jr-70-bragged-he-had-intimate-photographs-of-reporter-31,www.thedailybeast.com,married-rfk-jr-70-bragged-he-had-intimate-photographs-of-reporter-31
1fm68yl,My Tesla Cybertruck Windshield Shattered to Pieces While Washing it With a Microfiber Cloth,Fit-Requirement6701,technology,440,111,2024-09-21 15:59:53,https://www.torquenews.com/11826/my-tesla-cybertruck-windshield-shattered-pieces-while-washing-it-microfiber-cloth/amp,www.torquenews.com,11826
1flu0k9,"The FCC wants all phones unlocked in sixty days, AT&T and T-Mobile aren't so keen on the plan",lurker_bee,technology,4237,292,2024-09-21 03:29:45,https://www.androidauthority.com/fcc-60-day-unlock-tmo-3483642/,www.androidauthority.com,fcc-60-day-unlock-tmo-3483642
1fm8cbo,Starlink imposes $100 “congestion charge” on new users in parts of US,barweis,technology,294,47,2024-09-21 17:34:37,https://arstechnica.com/tech-policy/2024/09/starlink-imposes-100-congestion-charge-on-new-users-in-parts-of-us/,arstechnica.com,tech-policy
1fm2b60,Donald Trump Was 'Black Hole' for His Dad's Money: New Book Author,Coffee_n_wifi,politics,3312,201,2024-09-21 12:52:01,https://www.newsweek.com/donald-trump-black-hole-father-money-lucky-loser-book-1955593,www.newsweek.com,donald-trump-black-hole-father-money-lucky-loser-book-1955593
1flkfr6,"Cards Against Humanity sues SpaceX, alleges “invasion” of land on US/Mexico border",tricksterloki,technology,20563,993,2024-09-20 19:31:33,https://arstechnica.com/tech-policy/2024/09/cards-against-humanity-sues-spacex-alleges-invasion-of-land-on-us-mexico-border/,arstechnica.com,tech-policy
1flzpza,‘He is proud that women are dying?’: Harris blasts Trump for deadly Georgia abortion ban,Coffee_n_wifi,politics,3752,81,2024-09-21 10:09:39,https://www.msnbc.com/the-reidout/watch/vp-harris-on-deaths-linked-to-georgia-abortion-ban-trump-is-the-architect-of-this-crisis-219856453579,www.msnbc.com,the-reidout
1fm4nxd,X Loses Battle to Protect Genshin Impact Leaker's First Amendment Anonymity * TorrentFreak,ardi62,technology,307,24,2024-09-21 14:46:32,https://torrentfreak.com/x-loses-battle-to-protect-genshin-impact-leakers-first-amendment-anonymity-240921/,torrentfreak.com,x-loses-battle-to-protect-genshin-impact-leakers-first-amendment-anonymity-240921
1flzwls,Trump’s shutdown push falls flat with Republicans ,malcolm58,politics,3003,138,2024-09-21 10:22:36,https://thehill.com/homenews/house/4891309-trump-shutdown-voting-government-funding-house-republicans/,thehill.com,homenews
1fm51d1,California governor signs law to protect children from social media addiction | AP News,BobbyLucero,technology,232,23,2024-09-21 15:03:57,https://apnews.com/article/california-social-media-addiction-children-law-bc649326701f892a16be1159bc008d71,apnews.com,article
1fm292w,Former Snap design engineer on new AR glasses: 'Obviously bad',BlueLightStruct,technology,336,77,2024-09-21 12:48:49,https://finance.yahoo.com/news/former-snap-design-engineer-on-new-ar-glasses-obviously-bad-181408794.html,finance.yahoo.com,news
1fm0hs3,"Seth Meyers on JD Vance: ‘He’s Ted Cruz 2.0 – less nasal, more eyeliner’",Coffee_n_wifi,politics,2203,71,2024-09-21 11:03:23,https://www.theguardian.com/culture/2024/sep/20/late-night-jd-vance-ted-cruz,www.theguardian.com,culture
1fm00hi,"Joe Biden makes history by confirming 12th LGBTQ+ judge, the most of any presidency",Coffee_n_wifi,politics,2403,83,2024-09-21 10:30:15,https://www.lgbtqnation.com/2024/09/joe-biden-makes-history-by-confirming-12th-lgbtq-judge-the-most-of-any-presidency/,www.lgbtqnation.com,2024
1fm3yqe,Is Donald Trump a fascist?,superzepto,politics,1195,428,2024-09-21 14:13:16,https://www.theguardian.com/us-news/2024/sep/21/is-donald-trump-a-fascist,www.theguardian.com,us-news
1flu8d7,Trump’s Electoral College Power Play in Nebraska Is a Troubling Sign of Things to Come | He’s already pressuring lawmakers to change the rules in his favor. Imagine if he loses.,newfrontier58,politics,8462,415,2024-09-21 03:42:48,https://www.motherjones.com/politics/2024/09/trumps-electoral-college-power-play-in-nebraska-is-a-troubling-sign-of-things-to-come/,www.motherjones.com,politics
1fm0oz3,"Trump 'Is the Architect of This Crisis,' Says Harris of Women Killed by Abortion Bans",Coffee_n_wifi,politics,1772,30,2024-09-21 11:16:24,https://www.commondreams.org/news/kamala-harris-abortion,www.commondreams.org,news
1flk9q5,Cards Against Humanity is suing SpaceX for trespassing and filling its property with ‘space garbage’,esporx,technology,7490,257,2024-09-20 19:24:37,https://www.engadget.com/science/space/cards-against-humanity-is-suing-spacex-for-trespassing-and-filling-its-property-with-space-garbage-181828453.html,www.engadget.com,science
1fm6dk3,"Kamala Harris Is the Clear Choice for President - One candidate has spent her career as a dedicated public servant, who believes government exists to serve the people, the other has divided the nation for his own personal gain",Quirkie,politics,694,18,2024-09-21 16:05:27,https://www.rollingstone.com/politics/political-commentary/kamala-harris-president-rolling-stone-endorsement-1235096166/,www.rollingstone.com,politics
1fm0w7k,Kamala Harris attacks Trump over ‘immoral’ abortion bans at Wisconsin rally,zsreport,politics,1293,61,2024-09-21 11:29:37,https://www.theguardian.com/us-news/2024/sep/20/kamala-harris-trump-abortion-wisconsin,www.theguardian.com,us-news
1fln2ix,Cards Against Humanity is suing SpaceX for trespassing on its ‘pristine’ property,Old_Pen9843,technology,3422,162,2024-09-20 21:27:26,https://www.theverge.com/2024/9/20/24250269/cards-against-humanity-space-x-lawsuit-cameron-county-texas,www.theverge.com,2024
1fm4rcy,Doctors ‘fight like hell’ against a second Trump admin: ‘Elections do matter for your health’,Kashmir75,politics,656,40,2024-09-21 14:51:06,https://www.politico.com/news/2024/09/21/doctors-harris-support-public-health-00179165,www.politico.com,news
1flpq82,NC governor candidate cries AI fabrication as defense for racist porn forum posts,esporx,technology,2214,157,2024-09-20 23:35:00,https://arstechnica.com/information-technology/2024/09/nc-governor-candidate-cries-ai-fabrication-as-defense-for-racist-porn-forum-posts/,arstechnica.com,information-technology
1fm1vnw,"Harris' fundraising triples Trump's in August, growing Democrat's warchest, FEC filings show | Harris and the DNC raised $257 million, as Trump and the RNC raised $85 million.",SpaceElevatorMusic,politics,932,69,2024-09-21 12:28:19,https://abcnews.go.com/US/harris-trump-august-fundraising-fec-filings/story?id=113893128,abcnews.go.com,US
1fm776f,"Harris accepts CNN debate invitation for October 23, again challenging Trump to another showdown | CNN Politics",ThinkerSis,politics,399,76,2024-09-21 16:43:29,https://www.cnn.com/2024/09/21/politics/presidential-debate-harris-trump-cnn/index.html,www.cnn.com,2024
1fm3jzj,"Election-Deniers' Georgia Scheme Is Going Exactly According To Plan | 
The MAGA fanatics who hijacked the election board just passed a ballot-counting measure that could royally f*ck things up.",Murky-Site7468,politics,671,60,2024-09-21 13:54:06,https://www.esquire.com/news-politics/politics/a62303952/georgia-ballot-hand-count-election/,www.esquire.com,news-politics
1fm4elw,These evangelicals are voting their values — by backing Kamala Harris,schuey_08,politics,577,31,2024-09-21 14:34:17,https://apnews.com/article/evangelicals-harris-trump-christians-vote-9d5cb379dc3c2fdb3f4954c556a29ec5,apnews.com,article
1fm08h0,The Titan Submersible Disaster Hearings Paint a Damning Picture,Fit-Requirement6701,technology,225,47,2024-09-21 10:45:32,https://www.wired.com/story/titan-submersible-hearings-week-one-testimony-oceangate-implosion/,www.wired.com,story
1fm0zst,"As President, Trump Demanded Investigations of Foes. He Often Got Them.",projecto15,politics,867,46,2024-09-21 11:35:54,https://www.nytimes.com/2024/09/21/us/politics/trump-investigations-enemies.html?unlocked_article_code=1.MU4.NyIM.voDAk0dWxeTt&smid=re-share,www.nytimes.com,2024
1flxx54,Harris says she is trying to get a second debate with Trump,iymcool,politics,1472,168,2024-09-21 07:54:12,https://www.reuters.com/world/us/harris-says-she-is-trying-get-second-debate-with-trump-2024-09-20/,www.reuters.com,world
1flstxe,Republicans in NC remove Lt. Gov. Mark Robinson from their social media following new scandal,vsandrei,politics,4187,187,2024-09-21 02:21:14,https://www.cbs17.com/news/north-carolina-news/republicans-in-nc-remove-lt-gov-mark-robinson-from-their-social-media-following-new-scandal/,www.cbs17.com,news
1fm5htu,House members bypass Mike Johnson a second time to force Social Security vote,amir_twist_of_fate,politics,342,33,2024-09-21 15:25:20,https://www.axios.com/2024/09/19/discharge-petition-social-security-mike-johnson,www.axios.com,2024
1flk764,New Docs Reveal Horrific Extent of Matt Gaetz’s Creepy Sex Scandal,WafflePartyOrgy,politics,26339,930,2024-09-20 19:21:28,https://newrepublic.com/post/186197/matt-gaetz-sex-scandal-new-documents-minor,newrepublic.com,post
1fm72f3,Why GOP ‘Black Nazi’s’ Porn Posts Were Too Bonkers for CNN | CNN’s explosive report detailing posts allegedly from Republican Mark Robinson omitted a number of filthy details including him bragging about having sex with a relative.,WhileFalseRepeat,politics,255,40,2024-09-21 16:37:19,https://www.thedailybeast.com/why-gop-black-nazi-mark-robinsons-porn-posts-were-too-bonkers-for-cnn,www.thedailybeast.com,why-gop-black-nazi-mark-robinsons-porn-posts-were-too-bonkers-for-cnn
1fm6p6m,"Republicans ask for more civility in politics. That’s a joke, right? | The same team igniting a crisis in Springfield, Ohio, is telling Democrats to be careful.",plz-let-me-in,politics,267,40,2024-09-21 16:20:11,https://www.ajc.com/opinion/opinion-republicans-ask-for-more-civility-in-politics-thats-a-joke-right/WY2MUOM4BRC73JXZ7LQ4IIVR7M/,www.ajc.com,opinion
1flm3ft,Donald “America’s Hitler” Trump Gives Supporters the Green Light to Blame Jews If He Loses in November | He did this at an event on antisemitism.,plz-let-me-in,politics,12290,458,2024-09-20 20:44:03,https://www.vanityfair.com/news/story/donald-trump-gives-supporters-the-green-light-to-blame-jews-if-he-loses-in-november,www.vanityfair.com,news
1flkib6,"Mark Cuban says Trump's billionaire backers know they can manipulate him because he's 'so transactional, and so devoid of core values'",Silent-Resort-3076,politics,18262,331,2024-09-20 19:34:44,https://www.businessinsider.com/mark-cuban-says-trump-most-unethical-person-ever-business-2024-9,www.businessinsider.com,mark-cuban-says-trump-most-unethical-person-ever-business-2024-9
1flrj5p,"Secret calculator hack brings ChatGPT to the TI-84, enabling easy cheating",willyolio,technology,850,134,2024-09-21 01:08:33,https://arstechnica.com/information-technology/2024/09/secret-calculator-hack-brings-chatgpt-to-the-ti-84-enabling-easy-cheating/,arstechnica.com,information-technology
1flohfm,"Poll: Trump losing edge on economy, once his strongest issue",fortune,politics,6943,662,2024-09-20 22:33:06,https://fortune.com/2024/09/20/american-voters-split-harris-trump-better-economy-republican-advantage-fades/,fortune.com,2024
1flh8gx,"Biden-Harris Administration Announces Over $3 Billion to Support America's Battery Manufacturing Sector, Create Over 12,000 Jobs, and Enhance National Security",Chipdoc,technology,3433,139,2024-09-20 17:13:43,https://www.energy.gov/articles/biden-harris-administration-announces-over-3-billion-support-americas-battery,www.energy.gov,articles
1flqbx8,"Harris pins blame for deaths of two pregnant women on Georgia’s strict abortion law, Trump",SpaceElevatorMusic,politics,4386,87,2024-09-21 00:05:01,https://georgiarecorder.com/2024/09/20/harris-pins-blame-for-deaths-of-two-pregnant-women-on-georgias-strict-abortion-law-trump/,georgiarecorder.com,2024
1fm7128,SEC says Elon Musk should be sanctioned if he keeps dodging Twitter depositions,lala_b11,politics,200,22,2024-09-21 16:35:34,https://www.nbcnews.com/business/elon-musk-sec-sanctioned-twitter-deposition-rcna172098,www.nbcnews.com,business
1flm9xw,A Spokane police officer put a ‘Let’s Go Brandon’ sticker on his department car. He was fired,ShadowyFlows,politics,8518,324,2024-09-20 20:51:53,https://www.spokesman.com/stories/2024/sep/19/a-spokane-police-officer-put-a-lets-go-brandon-sti/,www.spokesman.com,stories
1flwbcy,Qualcomm wants to buy Intel,Logical_Welder3467,technology,251,61,2024-09-21 05:56:53,https://www.theverge.com/2024/9/20/24249949/intel-qualcomm-rumor-takeover-acquisition-arm-x86,www.theverge.com,2024
1fm0qpu,"“A climate of fear”: Trump's mass deportations could bring ""human misery"" in 2025",zsreport,politics,435,55,2024-09-21 11:19:33,https://www.salon.com/2024/09/21/a-climate-of-fear-mass-deportations-could-bring-human-misery-in-2025/,www.salon.com,2024
1flgvs7,Pro-Trump Georgia election board changes rules 45 days before election,newsweek,politics,24457,1697,2024-09-20 16:58:31,https://www.newsweek.com/georgia-election-ballots-hand-counting-donald-trump-1957062,www.newsweek.com,georgia-election-ballots-hand-counting-donald-trump-1957062
1fm7b44,Opinion: Will you be able to explain to your grandchildren why you supported Trump?,plz-let-me-in,politics,157,43,2024-09-21 16:48:10,https://www.pressherald.com/2024/09/21/opinion-allegiance-to-trump-is-baffling/,www.pressherald.com,2024
1fm7nsb,The Trump campaign doesn’t want to talk about Mark Robinson’s porn site controversy,z8675309z,politics,147,30,2024-09-21 17:03:42,https://www.msnbc.com/top-stories/latest/mark-robinson-trump-vance-porn-site-rcna172090,www.msnbc.com,top-stories
1fm87vq,Trump vows to ‘save’ vaping after private meeting with vaping lobbyist,newzee1,politics,137,65,2024-09-21 17:29:05,https://www.washingtonpost.com/politics/2024/09/21/trump-vaping-tobacco-lobbyist/,www.washingtonpost.com,politics
1flmr3v,GOP Rep. Matt Gaetz Attended Drug-Heavy Sex Party With 17-Year-Old: Legal Docs,SerenaLicks,politics,5785,153,2024-09-20 21:13:08,https://www.vanityfair.com/news/story/matt-gaetz-attended-drug-heavy-sex-party-with-17-year-old-legal-docs,www.vanityfair.com,news
1fm23y2,"Harris weighs in on Taylor Swift, ‘enjoyable’ debate with Trump in Wired interview",boxer_dogs_dance,politics,319,22,2024-09-21 12:41:04,https://thehill.com/homenews/campaign/4890243-vice-president-harris-wired-interview/,thehill.com,homenews
1fm7bq8,Kamala Harris Issues Challenge to Donald Trump After Accepting CNN Debate,Kiss_My_Wookiee,politics,146,18,2024-09-21 16:48:56,https://www.newsweek.com/kamala-harris-challenge-donald-trump-cnn-debate-1957344,www.newsweek.com,kamala-harris-challenge-donald-trump-cnn-debate-1957344
1fl7nkk,"Israel didn’t tamper with Hezbollah’s exploding pagers, it made them: NYT sources — First shipped in 2022, production ramped up after Hezbollah leader denounced the use of cellphones",marketrent,technology,15683,3159,2024-09-20 09:06:56,https://www.timesofisrael.com/israeli-spies-behind-hungarian-firm-that-was-linked-to-exploding-pagers-report/,www.timesofisrael.com,israeli-spies-behind-hungarian-firm-that-was-linked-to-exploding-pagers-report
1flx9e0,Kamala Harris posts huge cash advantage over Donald Trump,P_a_s_g_i_t_24,politics,845,71,2024-09-21 07:04:45,https://www.washingtonpost.com/politics/2024/09/20/kamala-harris-fundraising-advantage-trump/,www.washingtonpost.com,politics
1flp2sc,White Dudes for Harris hits Trump and his weaponized masculinity,Cute-Perception2335,politics,3771,140,2024-09-20 23:02:10,https://www.msnbc.com/top-stories/latest/white-dudes-for-harris-swing-states-trump-masculinity-rcna172017,www.msnbc.com,top-stories
1flwqg6,Trump Tells Jewish GOP Group Who He’d Blame for Losing: Jews,Real-Work-1953,politics,914,55,2024-09-21 06:26:12,https://www.thedailybeast.com/trump-hails-himself-israels-savior-in-fantastical-speech?ref=wrap,www.thedailybeast.com,trump-hails-himself-israels-savior-in-fantastical-speech
1flzhsx,SEC plans to reprimand Musk for skipping testimony on Twitter takeover,Cute-Perception2335,politics,461,53,2024-09-21 09:53:14,https://thehill.com/policy/technology/4891840-sec-reprimands-elon-musk-twitter,thehill.com,policy
1fm413q,"30 minutes from Springfield, another Ohio city welcomed immigrants — and got a boost",nosotros_road_sodium,politics,204,11,2024-09-21 14:16:23,https://www.npr.org/2024/09/20/nx-s1-5108947/immigrants-ohio-dayton-economy-job-growth,www.npr.org,2024
1flhuu3,Donald “Blame the Jews” Trump Is Truly Losing His Sh*t Now,scarymonst,politics,10767,565,2024-09-20 17:40:51,https://newrepublic.com/post/186191/donald-trump-blame-jews-losing-it,newrepublic.com,post
1fm39mn,Which Mexico are you? New Mexico furious after Texas installs razor wire along its border,JonAce,politics,227,56,2024-09-21 13:40:09,https://www.independent.co.uk/news/world/americas/us-politics/texas-new-mexico-border-wire-b2615743.html,www.independent.co.uk,news
1fm604s,"Amy Coney Barrett Encourages Open Democracy... That Is, If She Hasn't Already Impinged With Your Right To Vote",Fit-Requirement6701,politics,145,13,2024-09-21 15:48:56,https://abovethelaw.com/2024/09/amy-coney-barrett-encourages-open-democracy-that-is-if-she-hasnt-already-impinged-with-your-right-to-vote/,abovethelaw.com,2024
1fm5ffp,"2024 brings back fake electors for Donald Trump, even some facing charges for 2020",SpaceElevatorMusic,politics,157,21,2024-09-21 15:22:09,https://www.usatoday.com/story/news/politics/elections/2024/09/20/fake-electors-for-trump-2024/74955704007/,www.usatoday.com,story
1flme9p,Trump shares fake photo of Harris with Diddy in now-deleted Truth Social post,Oleg101,politics,4373,336,2024-09-20 20:57:21,https://www.nbcnews.com/tech/trump-shares-fake-photo-harris-diddy-now-deleted-truth-social-post-rcna171993,www.nbcnews.com,tech
1fm5qd0,"With one exaggerated anecdote, Trump kneecaps his Jan. 6 defense",NoPomegranate4794,politics,136,4,2024-09-21 15:36:24,https://www.washingtonpost.com/politics/2024/09/19/with-one-exaggerated-anecdote-trump-kneecaps-his-jan-6-defense/,www.washingtonpost.com,politics
1flzzbj,"Did Reagan pave the way for Trump? ‘You can trace the linkages,’ says biographer",bakhesh,politics,336,36,2024-09-21 10:28:06,https://www.theguardian.com/us-news/2024/sep/21/ronald-reagan-trump-comparisons-book-max-boot,www.theguardian.com,us-news
1flrx2g,"Republicans are using ruse of ""election integrity"" to pull off another round of Big Lie chicanery",marji80,politics,1737,51,2024-09-21 01:29:57,https://www.salon.com/2024/09/20/are-using-the-ruse-of-election-integrity-to-pull-of-another-round-of-big-lie-chicanery/,www.salon.com,2024
1fm2yic,Padma Lakshmi: Why Kamala Harris’s Love of Cooking Could Help Make Her a Great President,ishtar_the_move,politics,184,24,2024-09-21 13:25:07,https://www.nytimes.com/2024/09/21/opinion/padma-lakshmi-kamala-harris-cooking.html,www.nytimes.com,2024
1flc4yx,Three Mile Island is reopening and selling its power to Microsoft,thenewyorkgod,technology,3063,386,2024-09-20 13:33:41,https://www.cnn.com/2024/09/20/energy/three-mile-island-microsoft-ai?Date=20240920&Profile=cnnbrk&utm_content=1726838419&utm_medium=social&utm_source=twitter,www.cnn.com,2024
1fm8axk,Harris accepts invitation for second potential debate in October,redditofthebanned,politics,84,33,2024-09-21 17:32:50,https://www.nbcnews.com/politics/2024-election/harris-accepts-invitation-second-debate-october-rcna172104?cid=sm_npd_nn_tw_ma&taid=66ef029e77c383000145c35d&utm_campaign=trueanthem&utm_medium=social&utm_source=twitter,www.nbcnews.com,politics
1fm69j1,Harris fundraising far outpacing Trump's,Kiss_My_Wookiee,politics,114,4,2024-09-21 16:00:32,https://www.axios.com/2024/09/21/harris-fundraising-beats-trump,www.axios.com,2024
1flszrs,Harris speaks at Wisconsin rally after event in Georgia,yoppee,politics,1294,101,2024-09-21 02:30:34,https://www.washingtonpost.com/politics/2024/09/20/election-2024-campaign-updates-harris-trump/,www.washingtonpost.com,politics
1fm72tz,Trump Media closes at a new 52-week low on heavy trading after lockup expires,Silly-avocatoe,politics,100,30,2024-09-21 16:37:53,https://www.cnbc.com/2024/09/20/djt-trump-media-stock-selloff-lockup-.html,www.cnbc.com,2024
1flo0rv,"Previous video of Republican NC Gov candidate Mark Robinson saying ""During Jim Crow... black folks were at their highest"" is uncovered. ",Mordoch,politics,2825,216,2024-09-20 22:11:06,https://www.thebulwark.com/p/mark-robinson-black-americans-jim-crow,www.thebulwark.com,p
1fm5r2j,AI is helping shape the 2024 presidential race. But not in the way experts feared,GoMx808-0,technology,23,1,2024-09-21 15:37:17,https://apnews.com/article/artificial-intellgence-memes-trump-harris-deepfakes-256282c31fa9316c4059f09036c70fa9?utm_source=reddit&utm_medium=share,apnews.com,article
1flpvqx,MAGA World’s Belief In Their Made Up Claim That Biden Is ‘Censoring’ Conservatives On Social Media May Kill KOSA,vriska1,technology,418,101,2024-09-20 23:42:36,https://www.techdirt.com/2024/09/20/maga-worlds-belief-in-their-made-up-claim-that-biden-is-censoring-conservatives-on-social-media-may-kill-kosa/,www.techdirt.com,2024
1flt42d,"Letters to the Editor: I’m an 80-something Swiftie, a Republican and a Kamala Harris voter",yoppee,politics,1195,55,2024-09-21 02:37:32,https://www.latimes.com/opinion/letters-to-the-editor/story/2024-09-20/80-something-swiftie-a-republican-and-a-kamala-harris-voter,www.latimes.com,opinion
1fm45kx,"Trump is reaching the ‘But wait, there’s more!’ phase of the campaign ",Cute-Perception2335,politics,140,26,2024-09-21 14:22:18,https://www.msnbc.com/opinion/msnbc-opinion/trump-campaign-proposals-tax-cuts-rcna171853,www.msnbc.com,opinion
1fm6zaf,Harris campaign bashes Trump’s ‘online meltdown’ on abortion,bobeschism,politics,89,7,2024-09-21 16:33:17,https://thehill.com/homenews/campaign/4892173-kamala-harris-donald-trump-abortion-rhetoric/,thehill.com,homenews
1fm656w,"The New Era of Deadly Back-Alley Abortions Is Here | 
At events in Michigan and Georgia, Harris raises alarms about access under Trump by remembering women who died ending pregnancies.",Murky-Site7468,politics,99,3,2024-09-21 15:55:12,https://www.motherjones.com/politics/2024/09/kamala-harris-amber-thurman-candi-miller-abortion/,www.motherjones.com,politics
1flulhy,Harris slams Trump as ‘architect of this crisis’ in abortion speech,MTDreams123,politics,830,29,2024-09-21 04:04:08,https://www.washingtonpost.com/politics/2024/09/20/harris-trump-abortion/,www.washingtonpost.com,politics
1flzz0n,"Harris ups lead over Trump, although presidential race still on knife edge",bakhesh,politics,261,16,2024-09-21 10:27:31,https://www.theguardian.com/us-news/2024/sep/21/harris-leads-trump-presidential-poll,www.theguardian.com,us-news
1fle8av,Hillary Clinton: ‘It would be exhilarating to see Kamala Harris achieve the breakthrough I didn’t’,WhileFalseRepeat,politics,11540,1302,2024-09-20 15:05:46,https://www.theguardian.com/books/2024/sep/20/hillary-clinton-kamala-harris,www.theguardian.com,books
1fm8bga,Re-opened Three Mile Island will power AI data centers under new deal,barweis,technology,14,4,2024-09-21 17:33:30,https://arstechnica.com/ai/2024/09/re-opened-three-mile-island-will-power-ai-data-centers-under-new-deal/,arstechnica.com,ai
1fm19fx,"New York’s Prop 1 Closes the ‘Pregnancy’ Loophole—Protecting More Than Abortion | For too long, pregnancy and its outcomes have been the basis for denying women equal rights.",SenorBurns,politics,196,4,2024-09-21 11:52:31,https://msmagazine.com/2024/09/18/new-york-prop-1-pregnancy-abortion-era/,msmagazine.com,2024
