id,title,author,subreddit,score,num_comments,created_utc,url,website_source,sub_categories
1flki8s,Intel shares pop on report Qualcomm has approached it about takeover,Georgeika,technology,193,75,2024-09-20 19:34:39,https://www.cnbc.com/2024/09/20/qualcomm-reportedly-approached-intel-about-takeover.html,www.cnbc.com,2024
1flbv8s,Using GPT-4 to generate 100 words consumes up to 3 bottles of water — AI data centers also raise power and water bills for nearby residents,UltraNooob,technology,531,175,2024-09-20 13:21:10,https://www.tomshardware.com/tech-industry/artificial-intelligence/using-gpt-4-to-generate-100-words-consumes-up-to-3-bottles-of-water-ai-data-centers-also-raise-power-and-water-bills-for-nearby-residents,www.tomshardware.com,tech-industry
1fm4g72,Clever Social Engineering Attack Using Captchas,BigIllustrator4131,technology,8,5,2024-09-21 14:36:22,https://isc.sans.edu/diary/rss/31282,isc.sans.edu,diary
1flaxfs,It’s easy to find misinformation on social media. It’s even easier on X. ,Wagamaga,technology,586,24,2024-09-20 12:35:28,https://www.poynter.org/fact-checking/2024/how-elon-musk-twitter-takeover-accelerated-misinformation/,www.poynter.org,fact-checking
1fla783,Bacteria on the space station are evolving for life in space,waozen,technology,405,52,2024-09-20 11:57:34,https://www.newscientist.com/article/2448437-bacteria-on-the-space-station-are-evolving-for-life-in-space/,www.newscientist.com,article
1fl78ds,The EU still wants to scan your private chats,Martin_WK,technology,642,111,2024-09-20 08:34:07,https://www.techradar.com/computing/cyber-security/the-eu-still-wants-to-scan-your-private-chats-heres-what-you-can-do-about-it,www.techradar.com,computing
1flpwlf,Qualcomm reportedly approached Intel about a takeover. Analysts say they could face political scrutiny and 'little overlap.',flintflower,technology,39,7,2024-09-20 23:43:47,https://www.businessinsider.com/intel-qualcomm-takeover-bid-layoffs-foundry-spin-off-2024-9,www.businessinsider.com,intel-qualcomm-takeover-bid-layoffs-foundry-spin-off-2024-9
1fljc9t,NBA 2K25 Will Remove VC Packs In South Korea Due To Mandatory Disclosure Of Probability Information,esporx,technology,92,8,2024-09-20 18:44:25,https://twistedvoxel.com/nba-2k25-remove-vc-packs-mandatory-disclosure-probability-information-south-korea/,twistedvoxel.com,nba-2k25-remove-vc-packs-mandatory-disclosure-probability-information-south-korea
1fll9k2,Insecure software makers are the real cyber villains – CISA,FauxReal,technology,58,10,2024-09-20 20:07:41,https://www.theregister.com/2024/09/20/cisa_sloppy_vendors_cybercrime_villains/,www.theregister.com,2024
1fkxgax,FTC Says Social Media Platforms Engage in 'Vast Surveillance' of Users,draggedbyatruck,technology,2973,115,2024-09-19 22:50:17,https://gizmodo.com/ftc-says-social-media-platforms-engage-in-vast-surveillance-of-users-2000500840,gizmodo.com,ftc-says-social-media-platforms-engage-in-vast-surveillance-of-users-2000500840
1flvm3u,Spyware Injection Into Your ChatGPT's Long-Term Memory (SpAIware),waozen,technology,12,0,2024-09-21 05:09:18,https://embracethered.com/blog/posts/2024/chatgpt-macos-app-persistent-data-exfiltration/,embracethered.com,blog
1fm86es,"Next Generation Developer Day - London, UK - 8th October. Free all day event to learn all about building with and using generative AI",094459,technology,1,0,2024-09-21 17:27:16,https://go.aws/3MQuQsO,go.aws,3MQuQsO
1fl30i8,Ukraine’s Gun-Armed Ground 'Bot Just Cleared A Russian Trench In Kursk,Fit-Requirement6701,technology,1041,72,2024-09-20 03:39:17,https://www.forbes.com/sites/davidaxe/2024/09/19/ukraines-gun-armed-ground-robot-just-cleared-a-russian-trench-in-kursk/,www.forbes.com,sites
1fl7j17,FTC report proves your social media surveillance paranoia is real,BobbyLucero,technology,349,43,2024-09-20 08:57:41,https://www.androidauthority.com/ftc-2024-report-social-media-surveillance-3483396/,www.androidauthority.com,ftc-2024-report-social-media-surveillance-3483396
1fkne95,Brazil threatens X with $900k daily fine for circumventing ban | Semafor,crates-of-bigfoots,technology,10917,786,2024-09-19 15:18:36,https://www.semafor.com/article/09/19/2024/elon-musks-x-restores-service-in-brazil-despite-ban,www.semafor.com,article
1flnh38,Senate Vote Could Give Helping Hand To Patent Trolls,Anoth3rDude,technology,32,5,2024-09-20 21:46:03,https://www.eff.org/deeplinks/2024/09/senate-vote-tomorrow-could-give-helping-hand-patent-trolls,www.eff.org,deeplinks
1flbhaw,Apple put on notice over support for third-party watches and headphones,traffic-robot,technology,113,60,2024-09-20 13:02:47,https://www.theverge.com/2024/9/20/24249738/eu-dma-apple-ios-iphone-interoperability-smartwatches-headphones,www.theverge.com,2024
1fm3nux,"Interesting Engineering: Pudu unveils super semi-humanoid robot with 8-hour battery, 10kg lift power",BothZookeepergame612,technology,1,17,2024-09-21 13:59:20,https://interestingengineering.com/innovation/pudu-d7-semi-humanoid-robot,interestingengineering.com,innovation
1flig3z,"Chinese ""typhoon"" hackers threaten U.S. infrastructure",Fit-Requirement6701,technology,35,5,2024-09-20 18:05:28,https://www.axios.com/2024/09/20/china-critical-infrastructure-cyberattacks,www.axios.com,2024
1flzfv3,IBM Reduces Workforce: The Impact of AI on Employment,LollipopChainsawZz,technology,2,8,2024-09-21 09:49:04,https://nayrabizsphere.com/2024/09/ibms-ai-strategy-leads-to-job-cuts/,nayrabizsphere.com,2024
1fllh7d,Unique Combination of Microbes Could Treat Antibiotic-Resistant Infections | Technology Networks,FollowTheLeads,technology,24,1,2024-09-20 20:17:08,https://www.technologynetworks.com/immunology/news/unique-combination-of-microbes-could-treat-antibiotic-resistant-infections-391189,www.technologynetworks.com,immunology
1fl9z12,Mistrial declared for ex-AT&T exec accused of bribing government official,AdSpecialist6598,technology,98,4,2024-09-20 11:44:41,https://arstechnica.com/tech-policy/2024/09/mistrial-declared-for-ex-att-exec-accused-of-bribing-government-official/,arstechnica.com,tech-policy
1fkj7sc,Palworld maker vows to fight Nintendo lawsuit on behalf of fans and indie developers,ardi62,technology,8561,938,2024-09-19 12:08:40,https://www.eurogamer.net/palworld-developer-vows-to-fight-nintendo-lawsuit-on-behalf-of-fans-and-indie-developers,www.eurogamer.net,palworld-developer-vows-to-fight-nintendo-lawsuit-on-behalf-of-fans-and-indie-developers
1fkyleg,Chipmaker Qualcomm lays off hundreds of workers in San Diego,McFatty7,technology,852,81,2024-09-19 23:45:56,https://techcrunch.com/2024/09/19/chipmaker-qualcomm-lays-off-hundreds-of-workers-in-san-diego/,techcrunch.com,2024
1flt36u,"Lawson to work with KDDI, M'bishi Corp. to open 'convenience stores of the future' in Japan ",Saltedline,technology,6,3,2024-09-21 02:36:03,https://mainichi.jp/english/articles/20240920/p2a/00m/0bu/021000c,mainichi.jp,english
1fl2xg4,Exploding Pagers Sound Global Alarm for Supply-Chain Security,caveatlector73,technology,396,447,2024-09-20 03:34:25,https://www.bloomberg.com/news/articles/2024-09-19/exploding-pagers-sound-global-alarm-for-supply-chain-security?srnd=phx-technology,www.bloomberg.com,news
1flgcik,Former Snap Spectacles engineer says the new glasses are ‘obviously bad’,lurker_bee,technology,30,8,2024-09-20 16:35:21,https://www.theverge.com/2024/9/20/24249807/snap-spectacles-ar-glasses-developer-bad-comment,www.theverge.com,2024
1fkldkx,Iranian Hackers Tried to Tempt Biden’s Campaign With Stolen Trump Info | Hackers have been shopping the information around since the summer when they successfully spear phished a former senior campaign advisor.,chrisdh79,technology,3936,186,2024-09-19 13:51:54,https://gizmodo.com/iranian-hackers-tried-to-tempt-bidens-campaign-with-stolen-trump-info-2000500701,gizmodo.com,iranian-hackers-tried-to-tempt-bidens-campaign-with-stolen-trump-info-2000500701
1fkvqak,LinkedIn scraping user content for its AI without asking,jluizsouzadev,technology,936,67,2024-09-19 21:31:11,https://www.theregister.com/2024/09/19/linkedin_ai_data_access/?td=rt-3a,www.theregister.com,2024
1fl7jqv,Have Hezbollah's secret communications been compromised?,JeffCook78,technology,100,137,2024-09-20 08:59:15,https://www.newsweek.com/hezbollah-communications-compromised-pager-attacks-1956406,www.newsweek.com,hezbollah-communications-compromised-pager-attacks-1956406
1fkzw9b,The United Nations Wants to Treat AI With the Same Urgency as Climate Change,MetaKnowing,technology,426,99,2024-09-20 00:51:36,https://www.wired.com/story/united-nations-artificial-intelligence-report/,www.wired.com,story
1fm96l5,Apple’s Update Decision—Google Ridicules iPhone As Bad News Confirmed,Fit-Requirement6701,technology,0,1,2024-09-21 18:12:39,https://www.forbes.com/sites/zakdoffman/2024/09/21/apples-ios-18-update-googles-new-warning-for-millions-of-phone-15-iphone-16-users/,www.forbes.com,sites
1fll1xy,Qualcomm Approached Intel About a Takeover in Recent Days,notyour_motherscamry,technology,11,5,2024-09-20 19:58:37,https://www.wsj.com/business/deals/qualcomm-approached-intel-about-a-takeover-in-recent-days-fa114f9d?mod=hp_lead_pos1,www.wsj.com,business
1fkpot0,Low cognitive ability intensifies the link between social media use and anti-immigrant attitudes,a_Ninja_b0y,technology,1513,146,2024-09-19 16:54:54,https://www.psypost.org/low-cognitive-ability-intensifies-the-link-between-social-media-use-and-anti-immigrant-attitudes/,www.psypost.org,low-cognitive-ability-intensifies-the-link-between-social-media-use-and-anti-immigrant-attitudes
1fkjulu,Microsoft Executive Warns of Election Meddling in Final 48 Hours,Fit-Requirement6701,technology,3234,173,2024-09-19 12:40:45,https://www.bloomberg.com/news/articles/2024-09-18/microsoft-executive-warns-of-election-meddling-in-final-48-hours,www.bloomberg.com,news
1fksp6m,Apple introduces California driver’s licenses and state IDs in Apple Wallet as part of California DMV’s mDL pilot program,Puginator,technology,996,109,2024-09-19 19:00:12,https://www.apple.com/newsroom/2024/09/apple-brings-california-drivers-licenses-and-state-ids-to-apple-wallet/,www.apple.com,newsroom
1fkp5wm,Tor anonymity infiltrated: Law enforcement monitors servers successfully ,a_Ninja_b0y,technology,1502,74,2024-09-19 16:32:54,https://www.ghacks.net/2024/09/19/tor-anonymity-infiltrated-law-enforcement-monitors-servers-successfully/,www.ghacks.net,2024
1fkn1wy,"Palworld developer has no idea why Nintendo’s suing over its Pokémon-like game | In a statement released earlier today, Pocketpair said it isnt aware of any patents it infringed in developing Palworld.",chrisdh79,technology,1829,256,2024-09-19 15:04:11,https://www.theverge.com/2024/9/19/24248957/pocketpair-pokemon-patent-infrigement-lawsuit,www.theverge.com,2024
1fl6yma,"Canada’s Leaders Must Reject Overbroad Age Verification Bill | Canadian lawmakers are considering a bill, S-210, that’s meant to benefit children, but would sacrifice the security, privacy, and free speech of all internet users",a_Ninja_b0y,technology,71,8,2024-09-20 08:12:52,https://www.eff.org/deeplinks/2024/09/canadas-leaders-must-reject-overbroad-age-verification-bill,www.eff.org,deeplinks
1fl32t3,"Social media and online video firms are conducting ‘vast surveillance’ on users, FTC finds ",caveatlector73,technology,162,12,2024-09-20 03:43:01,https://www.theguardian.com/technology/2024/sep/19/social-media-companies-surveillance-ftc,www.theguardian.com,technology
1fl80rp,Huawei's trifold smartphone is launching the same day as the iPhone 16 — and it's already creating a frenzy on resale sites,ControlCAD,technology,42,135,2024-09-20 09:35:23,https://www.businessinsider.com/huawei-mate-xt-resale-prices-skyrocket-apple-2024-9,www.businessinsider.com,huawei-mate-xt-resale-prices-skyrocket-apple-2024-9
1fl8mvp,"Seeking to counter China, US awards $3 billion for EV battery production in 14 states",spherocytes,technology,41,3,2024-09-20 10:20:01,https://apnews.com/article/ev-batteries-lithium-biden-harris-china-3eaa57b34878a23dd55fe167eb8095f2,apnews.com,article
1fll776,"Tech giants push to dilute Europe's AI Act
",CatUsaUk,technology,6,3,2024-09-20 20:04:45,https://www.reuters.com/technology/artificial-intelligence/tech-giants-push-dilute-europes-ai-act-2024-09-20/,www.reuters.com,technology
1fkbjtk,YouTube confirms your pause screen is now fair game for ads,ardi62,technology,15726,2280,2024-09-19 03:27:57,https://www.theverge.com/2024/9/18/24248391/youtube-pause-ads-widely-rolling-out,www.theverge.com,2024
1flbzwu,"S. Korea, Czech Republic agree to team up for full cycle of nuclear energy industry",Saltedline,technology,19,0,2024-09-20 13:27:09,https://m-en.yna.co.kr/view/AEN20240920009051315?section=national/politics,m-en.yna.co.kr,view
1fm7cq1,Can AI Companions Help Cure the Loneliness Epidemic?,newzee1,technology,0,15,2024-09-21 16:50:11,https://www.wsj.com/health/wellness/ai-companions-loneliness-f6b16e98?st=mv1x9R,www.wsj.com,health
1fks4ck,Disney to Stop Using Slack Following Hack That Exposed Company Data,habichuelacondulce,technology,483,22,2024-09-19 18:35:20,https://www.wsj.com/business/disney-to-stop-using-slack-following-hack-that-exposed-company-data-c5311caf,www.wsj.com,business
1fm3w7h,"How Apple, Google, and Microsoft can save us from AI deepfakes",Franco1875,technology,0,2,2024-09-21 14:09:58,https://www.zdnet.com/article/how-apple-google-and-microsoft-can-save-us-from-ai-deepfakes/,www.zdnet.com,article
1fkhz5b,Justice Department disrupts vast Chinese hacking operation that infected consumer devices,zsreport,technology,1730,32,2024-09-19 10:57:04,https://apnews.com/article/fbi-justice-department-chinese-hacking-84e16185ae16367443a5e083adb74c8c,apnews.com,article
1flakwn,Microsoft’s AI Power Needs Prompt Revival of Three Mile Island Nuclear Plant,ead09,technology,15,5,2024-09-20 12:17:29,https://www.bnnbloomberg.ca/business/technology/2024/09/20/microsofts-ai-power-needs-prompt-revival-of-three-mile-island-nuclear-plant/,www.bnnbloomberg.ca,business
1fknea1,F.T.C. Study Finds ‘Vast Surveillance’ of Social Media Users,whosthesixth,technology,739,60,2024-09-19 15:18:37,https://www.nytimes.com/2024/09/19/technology/ftc-meta-tiktok-privacy-surveillance.html,www.nytimes.com,2024
1flydff,Qualcomm Approached Intel About a Takeover in Recent Days,n1ght_w1ng08,technology,0,0,2024-09-21 08:28:09,https://www.wsj.com/business/deals/qualcomm-approached-intel-about-a-takeover-in-recent-days-fa114f9d,www.wsj.com,business
1fkkmcp,Billionaire tech CEO says bosses shouldn't 'BS' employees about the impact AI will have on jobs,MetaKnowing,technology,904,178,2024-09-19 13:17:40,https://www.cnbc.com/2024/09/19/billionaire-tech-ceo-bosses-shouldnt-bs-employees-about-ai-impact.html,www.cnbc.com,2024
1flz0c8,Bank of Canada: AI could boost inflationary pressures in short-term,Advanced_Drink_8536,technology,0,1,2024-09-21 09:16:06,https://www.reuters.com/markets/bank-canada-ai-could-boost-inflationary-pressures-short-term-2024-09-20/,www.reuters.com,markets
1fkjwd6,Massive China-state IoT botnet went undetected for four years—until now,AdSpecialist6598,technology,863,79,2024-09-19 12:43:13,https://arstechnica.com/security/2024/09/massive-china-state-iot-botnet-went-undetected-for-four-years-until-now/,arstechnica.com,security
1fkhqgo,Lebanon bans pagers and walkie-talkies on flights,marketrent,technology,1084,347,2024-09-19 10:41:05,https://www.ynetnews.com/article/h1qaq00kp0,www.ynetnews.com,article
1fld9mo,Chechnya’s Kadyrov sends two Tesla Cybertrucks to Russian troops Ukraine as his own is disabled,duckanroll,technology,6,8,2024-09-20 14:24:08,https://novayagazeta.eu/articles/2024/09/20/chechnyas-kadyrov-sends-two-tesla-cybertrucks-to-ukraine-as-his-own-is-disabled-en-news,novayagazeta.eu,articles
1fl390z,Microsoft releases a new Windows app called Windows App for running Windows apps,ardi62,technology,41,64,2024-09-20 03:53:20,https://arstechnica.com/gadgets/2024/09/microsoft-releases-a-new-windows-app-called-windows-app-for-running-windows-apps/?comments=1,arstechnica.com,gadgets
1fkebs0,"Forget tedious paper applications, Americans can now renew passports online",a_Ninja_b0y,technology,1938,100,2024-09-19 06:21:31,https://www.npr.org/2024/09/18/g-s1-23620/americans-passport-renew-online,www.npr.org,2024
1fk2fbz,Apple iPhone 16 demand is so weak that employees can already buy it on discount,lurker_bee,technology,21538,2957,2024-09-18 20:13:57,https://qz.com/apple-iphone-16-pre-orders-sales-intelligence-ai-1851651638,qz.com,apple-iphone-16-pre-orders-sales-intelligence-ai-1851651638
1flom32,AI has returned chipmaking to the heart of computer technology,MarshallGrover,technology,0,2,2024-09-20 22:39:22,https://www.economist.com/technology-quarterly/2024/09/16/ai-has-returned-chipmaking-to-the-heart-of-computer-technology,www.economist.com,technology-quarterly
1fkg9y6,Google is going to show you even more ads on YouTube soon,thegravity98ms2,technology,910,353,2024-09-19 08:53:41,https://www.xda-developers.com/youtube-ads-pause-video/,www.xda-developers.com,youtube-ads-pause-video
1flynd9,Tips to prevent oversharing information about your kids online,KalkiKalpa,technology,0,16,2024-09-21 08:48:46,https://www.usatoday.com/story/tech/problemsolved/2024/09/20/how-to-protect-child-info-online/75208085007/,www.usatoday.com,story
1fkwi1j,How Lebanon's wireless paging system was weaponized to make Hezbollah devices explode,Zealousideal-Ask4232,technology,67,47,2024-09-19 22:05:16,https://www.voanews.com/a/how-lebanon-s-wireless-paging-system-was-weaponized-to-make-hezbollah-devices-explode/7791044.html,www.voanews.com,a
1fkslw0,FTC Staff Report Finds Large Social Media and Video Streaming Companies Have Engaged in Vast Surveillance of Users with Lax Privacy Controls and Inadequate Safeguards for Kids and Teens,net_dev_ops,technology,112,7,2024-09-19 18:55:52,https://www.ftc.gov/news-events/news/press-releases/2024/09/ftc-staff-report-finds-large-social-media-video-streaming-companies-have-engaged-vast-surveillance,www.ftc.gov,news-events
1fllgbw,AI tools help uncover enzyme mechanisms for lasso peptides,FollowTheLeads,technology,1,0,2024-09-20 20:16:05,https://phys.org/news/2024-09-ai-tools-uncover-enzyme-mechanisms.html,phys.org,news
1fkjfe5,“Dead Internet theory” comes to life with new AI-powered social media app,polimeema,technology,339,52,2024-09-19 12:19:36,https://arstechnica.com/information-technology/2024/09/dead-internet-theory-comes-to-life-with-new-ai-powered-social-media-app/,arstechnica.com,information-technology
1fl8ybe,Taiwan questions two in probe into Hezbollah pagers,MyNameCannotBeSpoken,technology,4,7,2024-09-20 10:42:20,https://www.timesofisrael.com/liveblog_entry/taiwan-questions-two-in-probe-into-hezbollah-pagers/,www.timesofisrael.com,liveblog_entry
1fk7v14,Nintendo and Pokémon are suing Palworld maker Pocketpair,esporx,technology,2511,496,2024-09-19 00:19:56,https://www.theverge.com/2024/9/18/24248602/nintendo-pokemon-palworld-pocketpair-patent-infringement-lawsuit,www.theverge.com,2024
1fkkupa,"Is That AI? Or Does It Just Suck? AI is becoming synonymous with things that are unbelievable, generic, or just a little bit off",StrngBrew,technology,220,16,2024-09-19 13:28:30,https://nymag.com/intelligencer/article/is-that-ai-or-does-it-just-suck.html,nymag.com,intelligencer
1fjz1fh,"Amazon CEO Andy Jassy ordered a five-day return to office policy, but research suggests he’ll backtrack next year",marketrent,technology,6143,282,2024-09-18 17:51:03,https://fortune.com/2024/09/18/amazon-andy-jassy-ordering-full-time-return-to-office-rto-research-backtrack/,fortune.com,2024
1fk9w2s,U.S. and allies seize control of massive Chinese tech spying network,taike0886,technology,1165,27,2024-09-19 02:00:59,https://www.msn.com/en-us/news/world/u-s-and-allies-seize-control-of-massive-chinese-tech-spying-network/ar-AA1qNHb6,www.msn.com,en-us
1fjvr5y, Walkie talkies explode in Lebanon at funeral for those killed in pager attack,geoxol,technology,8004,1736,2024-09-18 15:34:04,https://abc7.com/post/explosions-witnessed-beirut-funeral-hezbollah-members-child-killed-pager-attack/15320074/,abc7.com,post
1fl2zje,Palantir Wins $100 Million US Contract for AI Targeting Tech,caveatlector73,technology,10,4,2024-09-20 03:37:49,https://www.bloomberg.com/news/articles/2024-09-19/palantir-wins-100-million-us-contract-for-ai-targeting-tech?srnd=phx-technology,www.bloomberg.com,news
1fkesq3,Forced and Child Labor Abuses Found in 75% of Lithium Battery Supply Chains,Stock-Traffic-9468,technology,359,43,2024-09-19 06:57:31,https://www.wardsauto.com/suppliers/forced-and-child-labor-abuses-found-in-75-of-lithium-battery-supply-chains,www.wardsauto.com,suppliers
1fkp5jq,28 Years Later: Danny Boyle’s New Zombie Flick Was Shot on an iPhone 15,Fit-Requirement6701,technology,59,7,2024-09-19 16:32:28,https://www.wired.com/story/28-years-later-danny-boyles-new-zombie-flick-was-shot-on-an-iphone-15/,www.wired.com,story
